id,date,date-time,sender,message,type,notes,sentiment
,8/9/24,2024-08-09 09:32:24,Incoming,I went in to set up payment for your America express but I can’t see your bank account balance anymore. ,,,
,8/9/24,2024-08-09 09:48:58,Outgoing,Thank you. I’ll setup auto payment.,,,
,8/9/24,2024-08-09 09:57:28,Incoming,Okay you don’t want me looking at any of your finances anymore correct? ,,,
,8/9/24,2024-08-09 10:47:30,Outgoing,I’ll have to become financially responsible on my own now :),,,
,8/9/24,2024-08-09 10:48:25,Outgoing,I’m not going to renew plat so I can pay you back sooner. ,,,
,8/9/24,2024-08-09 10:49:35,Incoming,I don’t think I am going to renew either. ,,,
,8/9/24,2024-08-09 10:50:06,Incoming,How are sales for CCB coming? ,,,
,8/9/24,2024-08-09 10:59:19,Outgoing,I can focus on it now that the wedding is over.,,,
,8/9/24,2024-08-09 11:04:07,Outgoing,If things go well over the next few weeks I will renew.,,,
,8/9/24,2024-08-09 11:05:34,Incoming,They will. ,,,
,8/9/24,2024-08-09 11:05:57,Incoming,Now you don’t have anything to worry about but work. ,,,
,8/9/24,2024-08-09 11:06:14,Incoming,Congratulations ,,,
,8/9/24,2024-08-09 11:06:27,Incoming,You are a millionaire ,,,
,8/9/24,2024-08-09 11:06:54,Incoming,Now you can just work with the clients you want to. ,,,
,8/9/24,2024-08-09 11:14:54,Incoming,Did you decide where you’re moving to? ,,,
,8/9/24,2024-08-09 11:28:55,Incoming,Do you not want to share where your living with me since I am your X boyfriend now? ,,,
,8/9/24,2024-08-09 11:30:48,Outgoing,,,,
,8/9/24,2024-08-09 11:30:48,Outgoing,"No I haven’t decided yet. I’m going to schedule to look at three places next week. This was a place I liked that was originally too much but it just dropped $300 a couple of days ago. 

https://www.zillow.com/homedetails/403-S-Albany-Ave-Tampa-FL-33606/2079122927_zpid/?utm_campaign=iosappmessage&utm_medium=referral&utm_source=txtshare",,,
,8/9/24,2024-08-09 11:33:05,Incoming,"That is nice, I don’t think you sent me that one before but it looks familiar ",,,
,8/9/24,2024-08-09 11:34:19,Outgoing,No I didn’t because it wasn’t an option at the time. ,,,
,8/9/24,2024-08-09 11:35:51,Incoming,Got ya. ,,,
,8/9/24,2024-08-09 12:13:43,Incoming,"I know you said this passive aggressively because I was asking about paying me back. I’m sorry I brought that up, I was just upset that you are wanting to work in Chris company. But I get it you started that company with him 10 years ago and you love it. I am simply being jealous because I want someone like what he has with you.",,,
,8/9/24,2024-08-09 12:14:50,Incoming,"If you want to join plat join it, don’t let my jealously ruin that. ",,,
,8/9/24,2024-08-09 12:18:27,Outgoing,I wasn’t saying that passive aggressively at all. ,,,
,8/9/24,2024-08-09 12:19:35,Outgoing,You’ve got to drop the fucking story that you’ve fabricated. I’m so fucking sick of it. ,,,
,8/9/24,2024-08-09 12:20:53,Incoming,"Babe, that isn’t a story. You told me that you work with him because you started the company and don’t want to leave it. ",,,
,8/9/24,2024-08-09 12:21:19,Outgoing,You could have had that with me but instead you choose to literally obsess over something that you’ve built up to be so far away from reality it’s sickening. ,,,
,8/9/24,2024-08-09 12:22:46,Outgoing,"Dude, go use Doug Allen’s 10 steps gpt or something and get a grip on what the actual facts are and what the stories/meanings you’ve created are.",,,
,8/9/24,2024-08-09 12:26:50,Outgoing,You’re so far down the rabbit hole I think you’ve totally lost your grip on reality. ,,,
,8/9/24,2024-08-09 12:27:57,Outgoing,https://chat.openai.com/g/g-Cx5Z2cgzC-doug-allen-the-ten-steps-process,,,
,8/9/24,2024-08-09 12:31:54,Outgoing,,,,
,8/9/24,2024-08-09 12:31:54,Outgoing,"That’s the 10 step process GPT. For the love of God please use it and try to reclaim your sanity back.

Im sorry if I’m being mean but I literally have zero sympathy, empathy, or patience for this any longer.",,,
,8/9/24,2024-08-09 12:54:52,Incoming,"Okay I will use it, it sounds like the details of you wanting to work in Chris’s company isn’t accurate. So if I tell it a false story it wouldn’t be accurate. ",Chris,,
,8/9/24,2024-08-09 13:00:19,Incoming,What is the real story if that one isn’t the case? ,,,
,8/9/24,2024-08-09 13:06:15,Outgoing,Just talk to it and it will pull out the facts versus stories. ,,,
,8/9/24,2024-08-09 13:14:27,Incoming,How can it pull out the facts if I don’t even know what they are? ,,,
,8/9/24,2024-08-09 13:17:00,Outgoing,Why don’t you just try it instead of asking me? ,,,
,8/9/24,2024-08-09 13:21:34,Outgoing,Are you going to? Just tell it all the things you tell me. ,,,
,8/9/24,2024-08-09 13:26:16,Incoming,Yes I will tell it what I told you. I was just hoping you would clarify if what I said was not correct about you wanting to work in Chris company because you two started it 10 years ago etc,,,
,8/9/24,2024-08-09 16:35:30,Outgoing,Did you do it?,,,
,8/9/24,2024-08-09 16:35:45,Incoming,On the call with Mike ,,,
,8/9/24,2024-08-09 18:45:45,Outgoing,How was that?,,,
,8/9/24,2024-08-09 18:46:04,Incoming,It went very well. ,,,
,8/9/24,2024-08-09 18:48:09,Outgoing,How so?,,,
,8/9/24,2024-08-09 18:49:48,Outgoing,Meaning do you feel the same about everything?,,,
,8/9/24,2024-08-09 18:51:46,Incoming,That question is a bit broad. But I have clear understanding and direction on what I want out of life. We both deserve to be happy and get what we want. ,,,
,8/9/24,2024-08-09 18:52:21,Outgoing,It’s not broad. I was referring to us. ,,,
,8/9/24,2024-08-09 19:53:01,Incoming,I fly out tomorrow at 7am if you were wanting to talk in person before I left,,,
,8/9/24,2024-08-09 20:03:29,Outgoing,If you’re flying out that already tells me everything I need to know. ,,,
,8/9/24,2024-08-09 20:04:24,Incoming,Babe I was always flying out because there is a meet up Saturday with all the Indiana plats. We talked about this in Denver. I was complaining because I was flying back and fourth,,,
,8/9/24,2024-08-09 20:06:45,Outgoing,That better be a really good meetup to be flying all the way back for it. ,,,
,8/9/24,2024-08-09 20:07:58,Incoming,"No it’s just all of us getting together down town, but you made a great point about getting to know plats and I haven’t gotten to know really any of them ",,,
,8/9/24,2024-08-09 20:09:00,Outgoing,I was referring to the place you supposedly live.,,,
,8/9/24,2024-08-09 20:09:25,Outgoing,Although we both know that’s not the case.,,,
,8/9/24,2024-08-09 20:15:31,Incoming,"Babe, I do live here. That’s why I am changing my residency. ",,,
,8/9/24,2024-08-09 20:23:51,Outgoing,Ok,,,
,8/9/24,2024-08-09 20:25:00,Outgoing,I’m going to take Lexi for a walk so I can meet you somewhere. ,,,
,8/9/24,2024-08-09 20:30:35,Incoming,"Megan, an Uber gift from Brandon is coming your way!",,,
,8/9/24,2024-08-09 20:30:38,Incoming,https://www.ubereats.com/giftcard/redeem?eatsOrderUuid=68ab2e9e-c83f-40c6-8632-77aebb9fa26b&nocache=true,,,
,8/9/24,2024-08-09 20:30:57,Incoming,Okay sounds good ,,,
,8/9/24,2024-08-09 20:31:42,Outgoing,Thank you but why did you send me that? I’m walking out the door now. ,,,
,8/9/24,2024-08-09 20:32:42,Incoming,I bought it earlier ,,,
,8/9/24,2024-08-09 20:32:57,Incoming,I didn’t realize I didn’t send it ,,,
,8/9/24,2024-08-09 20:34:22,Outgoing,When?,,,
,8/9/24,2024-08-09 20:34:45,Incoming,Maybe 20 minutes ago,,,
,8/9/24,2024-08-09 20:42:45,Outgoing,Where do you want me to meet you?,,,
,8/9/24,2024-08-09 20:43:05,Incoming,I’m walking toward your place now ,,,
,8/9/24,2024-08-09 20:43:55,Outgoing,So where do you want to meet?,,,
,8/9/24,2024-08-09 20:44:10,Incoming,In front of your place ,,,
,8/9/24,2024-08-09 20:45:01,Outgoing,I don’t want to meet at my place ,,,
,8/9/24,2024-08-09 20:45:34,Incoming,"Okay, where are you? ",,,
,8/9/24,2024-08-09 20:46:33,Outgoing,�,,,
,8/9/24,2024-08-09 21:54:10,Outgoing,I’m never going to forgive you for this.,,,
,8/9/24,2024-08-09 21:57:45,Incoming,"Babe, you have been the highlight of my life. I am so grateful to have been able to fall in love with you.  I want you to be happy and get everything you want in life. ",,,
,8/9/24,2024-08-09 21:58:01,Outgoing,Stop with that shit ,,,
,8/9/24,2024-08-09 21:58:41,Outgoing,A close relationship is he can’t watch Lexi? Are you fucking serious?! ,,,
,8/9/24,2024-08-09 21:59:57,Outgoing,That just proves to me how selfish you are. You would rather have me have complete strangers watch her which is not in her or my best interest because you are jealous.,,,
,8/9/24,2024-08-09 22:01:47,Incoming,"Megan, you didn’t have Chris watch her until this year. It’s not like he has been watching her for the past 10 years",,,
,8/9/24,2024-08-09 22:02:51,Outgoing,Why does that fucking matter? She’s also older and has health issues now. If my family were here or you were here then they or you would watch her.,,,
,8/9/24,2024-08-09 22:03:55,Outgoing,I should have trusted my intuition from the start and not believed a word that came out of your mouth. ,,,
,8/9/24,2024-08-09 22:04:51,Incoming,"Babe, I’m not saying I am right. I have a vision for a relationship and I don’t want the past influencing the present in anyway. Just like you have a standard of your man making money, I have standards and wants as well. ",,,
,8/9/24,2024-08-09 22:05:04,Outgoing,Stop fucking calling me babe,,,
,8/9/24,2024-08-09 23:54:13,Outgoing,I want you to come over and sleep with me. ,,,
,8/9/24,2024-08-09 23:54:46,Incoming,I’m on my way. ,,,
,8/9/24,2024-08-09 23:58:37,Incoming,Is the door unlocked? ,,,
,8/9/24,2024-08-09 23:58:48,Outgoing,Yes,,,
,8/10/24,2024-08-10 12:46:25,Incoming,,,,
,8/10/24,2024-08-10 15:05:33,Outgoing,I’ll get a flight from Indiana. What’s the gate? ,,,
,8/10/24,2024-08-10 15:05:44,Incoming,B2,,,
,8/10/24,2024-08-10 15:06:08,Incoming,"Yes Mike agreed with me, you can text him and ask him for confirmation ",,,
,8/10/24,2024-08-10 15:06:17,Outgoing,No he fucking didn’t ,,,
,8/10/24,2024-08-10 15:06:37,Outgoing,I’ll ask Tammy right now,,,
,8/10/24,2024-08-10 15:06:42,Incoming,You can ask them ,,,
,8/10/24,2024-08-10 15:06:58,Outgoing,Find me a flight home from Atlanta,,,
,8/10/24,2024-08-10 15:09:03,Incoming,If you have changed your mind and don’t want to join me in Indiana I will search for a flight for you ,,,
,8/10/24,2024-08-10 15:09:18,Outgoing,That’s what I just asked,,,
,8/11/24,2024-08-11 12:24:36,Incoming,,,,
,8/11/24,2024-08-11 12:24:47,Incoming,That’s what I wanted with the balcony off the master ,,,
,8/11/24,2024-08-11 12:29:21,Outgoing,Yes I would love a balcony like that. ,,,
,8/11/24,2024-08-11 12:30:54,Incoming,Those windows are going right into the master. So can get auto black out shades that open at sunrise ,,,
,8/11/24,2024-08-11 13:11:57,Incoming,,,,
,8/11/24,2024-08-11 13:19:26,Outgoing,That’s pretty,,,
,8/11/24,2024-08-11 13:24:46,Incoming,Yea it’s amazing ,,,
,8/11/24,2024-08-11 13:56:12,Incoming,Are you wanting to go to the Cortes? ,,,
,8/11/24,2024-08-11 13:56:16,Incoming,Course ,,,
,8/11/24,2024-08-11 14:06:15,Outgoing,And do what?,,,
,8/11/24,2024-08-11 14:11:49,Incoming,"Pool, or do you want to hit some balls? ",,,
,8/11/24,2024-08-11 14:11:56,Incoming,What do you want to do? ,,,
,8/11/24,2024-08-11 14:17:59,Outgoing,No I don’t want to go. ,,,
,8/11/24,2024-08-11 14:43:44,Incoming,Okay. ,,,
,8/11/24,2024-08-11 14:43:51,Incoming,Do you want some steak? ,,,
,8/11/24,2024-08-11 14:44:13,Outgoing,Always,,,
,8/11/24,2024-08-11 14:51:16,Incoming,"Okay, any sides? ",,,
,8/11/24,2024-08-11 14:55:00,Outgoing,Where are you eating? ,,,
,8/11/24,2024-08-11 14:55:22,Outgoing,I thought you meant us get steak. ,,,
,8/11/24,2024-08-11 15:02:37,Incoming,"I did mean us, I was going to cook it or we can go to Anthony’s chop house in Carmel if you want ",,,
,8/11/24,2024-08-11 15:03:34,Outgoing,Either is good.,,,
,8/11/24,2024-08-11 15:12:33,Incoming,We can go there tonight and grill tomorrow,,,
,8/12/24,2024-08-12 08:22:41,Outgoing,What’s the address and the garage code so I can close it?,,,
,8/12/24,2024-08-12 08:24:30,Incoming,You just press enter when you leave ,,,
,8/12/24,2024-08-12 08:24:48,Incoming,"8383 Craig street, ste 150 Indianapolis Indiana 46250",,,
,8/13/24,2024-08-13 08:37:43,Incoming,Did you change your flight ,,,
,8/13/24,2024-08-13 08:41:06,Outgoing,I’m trying to now. ,,,
,8/13/24,2024-08-13 08:46:35,Incoming,Okay. Let me know if you can’t ,,,
,8/13/24,2024-08-13 08:47:38,Outgoing,"409927954
Mandypup1

It’s being crazy. I tried the app, safari and chrome on desktop. 

Can you try logging into my account? 

Every time I go to confirm the change it asked me to login again, even though I’m already logged in and I can see all my account information.",,,
,8/13/24,2024-08-13 08:47:51,Incoming,Yes ,,,
,8/13/24,2024-08-13 08:47:54,Outgoing,If you can’t do it I’ll call Southwest ,,,
,8/13/24,2024-08-13 08:51:25,Incoming,It’s changed to tomorrow,,,
,8/13/24,2024-08-13 08:52:03,Outgoing,Thank you! That was so weird.,,,
,8/13/24,2024-08-13 08:52:27,Incoming,It’s because I booked it on my account ,,,
,8/13/24,2024-08-13 13:20:46,Incoming,Made it ,,,
,8/13/24,2024-08-13 13:22:10,Outgoing,Woohoo! Were you the last one on the plane?,,,
,8/13/24,2024-08-13 13:23:00,Incoming,"No I wasn’t, walked up and they were boarding my group so still a few behind me ",,,
,8/13/24,2024-08-13 13:51:18,Incoming,Can you get that package at my door and put it in the fridge please? ,,,
,8/13/24,2024-08-13 13:52:32,Outgoing,Yes,,,
,8/13/24,2024-08-13 13:53:03,Incoming,Thank You ,,,
,8/13/24,2024-08-13 15:49:09,Incoming,Tomorrow taylor is getting Charles so before you leave please put him in the backyard with a full food and water bowl,,,
,8/13/24,2024-08-13 16:27:53,Outgoing,Ok I will. I was just about to ask you when he was picking him up. ,,,
,8/13/24,2024-08-13 16:28:48,Incoming,Got it covered. He may swing by tonight but if not tomorrow,,,
,8/13/24,2024-08-13 16:29:17,Outgoing,Ok,,,
,8/14/24,2024-08-14 09:04:59,Outgoing,,,,
,8/14/24,2024-08-14 09:04:59,Outgoing,"I found two places in st. Pete that I think I would like. It’s a 5 min or 10 mintute bike ride to downtown according to the Google maps. 

https://www.zillow.com/homedetails/981-9th-Ave-S-Saint-Petersburg-FL-33705/47181658_zpid/?utm_campaign=iosappmessage&utm_medium=referral&utm_source=txtshare",,,
,8/14/24,2024-08-14 09:07:07,Outgoing,https://www.zillow.com/homedetails/709-11th-Ave-S-Saint-Petersburg-FL-33701/47230447_zpid/?utm_campaign=iosappmessage&utm_medium=referral&utm_source=txtshare,,,
,8/14/24,2024-08-14 09:18:06,Incoming,Is that for you or Meg ,,,
,8/14/24,2024-08-14 09:18:08,Incoming,Me?,,,
,8/14/24,2024-08-14 09:37:31,Incoming,The blue one is bigger. ,,,
,8/14/24,2024-08-14 09:54:59,Outgoing,For me. ,,,
,8/14/24,2024-08-14 09:55:39,Outgoing,Those are just the first ones I’ve seen in my price point there that I don’t hate.,,,
,8/14/24,2024-08-14 09:57:16,Incoming,Yea I like them ,,,
,8/14/24,2024-08-14 10:04:15,Outgoing,My flight is taking off now. ,,,
,8/14/24,2024-08-14 10:05:47,Outgoing,"Those hotel toiletries I always put in your bag were useful today.

I had already packed my bag and needed toothpaste :)",,,
,8/14/24,2024-08-14 10:19:44,Incoming,Haha perfect ,,,
,8/14/24,2024-08-14 14:07:36,Outgoing,Send me the video from the other night please,,,
,8/14/24,2024-08-14 14:08:25,Incoming,"Okay, I will when I am not sitting next to Jesse ",,,
,8/14/24,2024-08-14 14:09:13,Outgoing,No rush. I have others :),,,
,8/14/24,2024-08-14 14:09:58,Incoming,lol,,,
,8/14/24,2024-08-14 14:16:21,Incoming,,,,
,8/14/24,2024-08-14 14:16:21,Incoming,,,,
,8/14/24,2024-08-14 14:16:21,Incoming,,,,
,8/14/24,2024-08-14 14:16:21,Incoming,�,,,
,8/14/24,2024-08-14 14:22:50,Outgoing,,,,
,8/14/24,2024-08-14 14:22:50,Outgoing,I forgot about this picture lol. ,,,
,8/14/24,2024-08-14 14:54:59,Incoming,lol,,,
,8/14/24,2024-08-14 15:40:38,Incoming,Why does it say you just started following me on Instagram? Someone set up a fake account? ,,,
,8/14/24,2024-08-14 15:42:10,Outgoing,Because I blocked you the other night after I left your apartment and I didn’t realize when when I unblocked you it stopped following you as well. ,,,
,8/14/24,2024-08-14 15:42:34,Incoming,O okay ,,,
,8/14/24,2024-08-14 15:43:12,Outgoing,I didn’t realize your account was private. If you’re trying to grow your online presence is should definitely be public. ,,,
,8/14/24,2024-08-14 15:44:16,Incoming,It isn’t private ,,,
,8/14/24,2024-08-14 15:49:22,Incoming,It’s set to public ,,,
,8/14/24,2024-08-14 15:52:28,Outgoing,,,,
,8/14/24,2024-08-14 15:52:28,Outgoing,Yea I just tested it. I guess it just showed private after I unblocked you but it must be just temporary. ,,,
,8/14/24,2024-08-14 15:52:59,Incoming,"Hmm, yea must be. I just checked and it says public ",,,
,8/14/24,2024-08-14 15:53:50,Outgoing,It is. I just unfollowed you and followed you back to test it and it was public. ,,,
,8/14/24,2024-08-14 15:54:46,Outgoing,,,,
,8/14/24,2024-08-14 15:54:46,Outgoing,When I followed you back it recommended I follow this girl based on your friends. ,,,
,8/14/24,2024-08-14 15:55:12,Incoming,Real estate broker who lives in Tampa ,,,
,8/14/24,2024-08-14 15:56:02,Outgoing,Unfollow,,,
,8/14/24,2024-08-14 15:56:37,Outgoing,I’m sure that’s why you are following her. For real estate advice. ,,,
,8/14/24,2024-08-14 15:57:03,Incoming,"She followed me the other day, David the guy I had lunch with told her about our company. She lives in his building. ",,,
,8/14/24,2024-08-14 16:01:29,Outgoing,Cool,,,
,8/14/24,2024-08-14 16:07:00,Incoming,No I’m not following her for real estate advice at all. She followed me and I followed her back. ,,,
,8/14/24,2024-08-14 16:07:22,Outgoing,K,,,
,8/14/24,2024-08-14 16:07:54,Incoming,,,,
,8/14/24,2024-08-14 16:09:03,Outgoing,I just get angry when I know if roles were reversed you would flip.,,,
,8/14/24,2024-08-14 16:09:38,Incoming,What role exactly? ,,,
,8/14/24,2024-08-14 16:12:19,Outgoing,*Situation was reversed ,,,
,8/14/24,2024-08-14 16:12:30,Outgoing,If I started following and messaging a random guy in Tampa   ,,,
,8/14/24,2024-08-14 16:12:58,Incoming,You do follow other guys in Tampa and have had messages with them. ,,,
,8/14/24,2024-08-14 16:13:37,Outgoing,Like who? ,,,
,8/14/24,2024-08-14 16:14:08,Outgoing,I swear to god don’t say what I think your going to,,,
,8/14/24,2024-08-14 16:14:15,Incoming,Are you saying you don’t follow any guys in Tampa and don’t have any messages with them? ,,,
,8/14/24,2024-08-14 16:16:06,Outgoing,"No, you’ve looked through all my messages on Instagram and my phone so you already know the answer. ",,,
,8/14/24,2024-08-14 16:16:49,Incoming,"Okay, if you don’t follow any guys from Tampa and have messages with any of them I believe you. ",,,
,8/14/24,2024-08-14 16:17:13,Outgoing,You’ve gone through my messages. You already know that. ,,,
,8/14/24,2024-08-14 16:17:48,Incoming,I already know what? That you don’t have any messages with any guys from Tampa? ,,,
,8/14/24,2024-08-14 16:18:07,Outgoing,Yes,,,
,8/14/24,2024-08-14 16:19:54,Incoming,Okay. You’re right if you messaged another guy from Tampa I wouldn’t be happy. Thank you for pointing that out. ,,,
,8/14/24,2024-08-14 16:20:02,Outgoing,You can follow and talk to as many naked girls as you would like. Just don’t be a hypocrite.,,,
,8/14/24,2024-08-14 16:20:55,Incoming,"I’m not, you said you don’t follow or have messages with any guys from Tampa. If you did I am sure you wouldn’t be bringing this up. ",,,
,8/14/24,2024-08-14 16:21:00,Outgoing,Not happy about it would be a very big understatement.,,,
,8/14/24,2024-08-14 16:22:35,Incoming,Yes it would. But you don’t have any messages with any guys from Tampa. It would be hypocritical if I were to get mad at you for something I was doing too. ,,,
,8/14/24,2024-08-14 16:23:32,Outgoing,Don’t do it Brandon. ,,,
,8/14/24,2024-08-14 16:23:52,Incoming,Don’t be a hypocrite? ,,,
,8/14/24,2024-08-14 16:24:50,Outgoing,I know exactly what you are passively aggressively referring to.,,,
,8/14/24,2024-08-14 16:25:37,Outgoing,Not the same thing.,,,
,8/14/24,2024-08-14 16:27:00,Incoming,"You’re right, I don’t know this women nor have I had sex with her. We also are clearly talking about work as you can see from the message. ",,,
,8/14/24,2024-08-14 16:28:16,Outgoing,"Ok, so in the future when you want to flip out about something stupid, don’t. ",,,
,8/14/24,2024-08-14 16:29:52,Incoming,How about you unfollow Chris and I will unfollow her ,Chris,,
,8/14/24,2024-08-14 16:30:12,Outgoing,Wow,,,
,8/14/24,2024-08-14 16:30:42,Incoming,"I know, crazy you asked me to unfollow her and get mad when I tell you to unfollow your X boyfriend ",,,
,8/14/24,2024-08-14 16:31:36,Outgoing,I can’t believe you can’t go 1 day away from each other without bringing him up.,,,
,8/14/24,2024-08-14 16:33:38,Incoming,You asked me to unfollow someone to start it all. Someone I haven’t fucked ,,,
,8/14/24,2024-08-14 16:35:50,Outgoing,That’s how different I see the situations. Chris doesn’t even cross my mind in that context. I was referring to the fact if I met a guy in Tampa that did whatever the guy version of posting naked pictures as a girl and I started following him and talking and you looked through my phone you would have a meltdown.,,,
,8/14/24,2024-08-14 16:37:13,Outgoing,Follow as many porn stars as you would like. Have a good week.,,,
,8/14/24,2024-08-14 16:38:07,Incoming,The equivalent would be having a bunch of shirtless stuff on there profile. ,,,
,8/14/24,2024-08-14 16:38:19,Outgoing,No it wouldn’t.,,,
,8/14/24,2024-08-14 16:38:45,Incoming,"Yes megan, I agree she shows way to much online which is why I would never ever date a women that does that. ",,,
,8/14/24,2024-08-14 16:39:08,Outgoing,"You’re at a fucking Tony Robbins event, can you not even get a grip in that environment?",,,
,8/14/24,2024-08-14 16:39:11,Incoming,"My women’s body is for me, no one else. Girls like that are after attention which isn’t what I want ",,,
,8/14/24,2024-08-14 16:39:28,Incoming,Yes I can. ,,,
,8/14/24,2024-08-14 16:39:56,Outgoing,I really don,,,
,8/14/24,2024-08-14 16:41:45,Incoming,I understand. ,,,
,8/14/24,2024-08-14 16:42:08,Outgoing,You understand what?,,,
,8/14/24,2024-08-14 16:42:46,Incoming,That you are really done ,,,
,8/14/24,2024-08-14 16:43:43,Outgoing,"I sent that last text message too soon, but what I was typing was that I really don’t care about you following her or talking to her. I was just pointing it out so that in the future before you snap about something if there was a text message from someone random or an Instagram message it doesn’t mean oh shit hits the fan.",,,
,8/14/24,2024-08-14 16:44:25,Outgoing,What the fuck are you talking about?,,,
,8/14/24,2024-08-14 16:44:40,Incoming,"I wasn’t mad at you, I understood why you wouldn’t want me to follow her. Which is why I sent you a screen shot of the conversation without you asking ",,,
,8/14/24,2024-08-14 16:44:52,Outgoing,That doesn’t even come close to saying that,,,
,8/14/24,2024-08-14 16:45:17,Incoming,Okay thank you for the clarification ,,,
,8/14/24,2024-08-14 16:45:22,Outgoing,Why would you be mad at me?,,,
,8/14/24,2024-08-14 16:45:30,Outgoing,I didn’t think you were.,,,
,8/14/24,2024-08-14 16:45:46,Incoming,For you asking me to unfollow her ,,,
,8/14/24,2024-08-14 16:50:11,Incoming,You should reach out to JJ. He just stood up and he has a coaching business. Would be ideal for an online course for his students. He is doing tony Robbins stuff for tennagers  ,,,
,8/15/24,2024-08-15 10:59:07,Outgoing,I don’t want to fight about stupid things anymore. I love you. When Morning I rolled over and expected you to be there.,,,
,8/15/24,2024-08-15 11:04:11,Incoming,Loved “I don’t want to fight about stupid things anymore.…”,,,
,8/15/24,2024-08-15 11:04:20,Incoming,This morning you rolled over and expected me to be there?,,,
,8/15/24,2024-08-15 12:24:57,Outgoing,While I was still half asleep. Not actually expected you to be there when I remembered you were at BM.,,,
,8/15/24,2024-08-15 12:48:40,Incoming,What time did you get up? ,,,
,8/15/24,2024-08-15 13:03:48,Outgoing,A little bit before I text you. Around 10:30. I only slept the night before for a couple of hours and didn’t sleep the night before that.,,,
,8/15/24,2024-08-15 13:04:21,Outgoing,,,,
,8/15/24,2024-08-15 13:04:21,Outgoing,I just picked up an Amazon package and this was there. I love it ❤️,,,
,8/15/24,2024-08-15 13:13:27,Incoming,Loved “I just picked up an Amazon package and this was th…”,,,
,8/15/24,2024-08-15 13:17:29,Outgoing,Where did you get it?,,,
,8/15/24,2024-08-15 13:18:59,Incoming,Paid a kid I saw doing graffiti ,,,
,8/15/24,2024-08-15 13:21:10,Outgoing,Funny,,,
,8/15/24,2024-08-15 13:21:32,Incoming,He did a pretty good job. ,,,
,8/15/24,2024-08-15 13:28:06,Incoming,Jessica is here with her husband ,,,
,8/15/24,2024-08-15 13:52:42,Outgoing,Jessica who?,,,
,8/15/24,2024-08-15 14:20:16,Incoming,The one we had dinner with in Australia ,,,
,8/15/24,2024-08-15 17:05:28,Outgoing,Oh that’s really weird. Did you talk to her at all? Do they have the business together? ,,,
,8/15/24,2024-08-15 17:06:15,Incoming,"Yea I talked to them, he is an electrician. So no he doesn’t own part of her business. Hell yea it’s weird he is moving in to her house. ",,,
,8/15/24,2024-08-15 17:06:16,Outgoing,I thought she was divorced,,,
,8/15/24,2024-08-15 17:06:21,Incoming,She is,,,
,8/15/24,2024-08-15 17:06:33,Incoming,They just got married l,,,
,8/15/24,2024-08-15 17:07:01,Outgoing,A new guy or her ex husband and her got remarried. ,,,
,8/15/24,2024-08-15 17:07:18,Incoming,Not her X husband ,,,
,8/15/24,2024-08-15 17:07:32,Incoming,He has his own daughter ,,,
,8/15/24,2024-08-15 17:07:38,Incoming,Then her two sons ,,,
,8/15/24,2024-08-15 17:07:43,Outgoing,Is Mark there too? ,,,
,8/15/24,2024-08-15 17:07:56,Incoming,"Yes, but he doesn’t give two shits ",,,
,8/15/24,2024-08-15 17:18:16,Outgoing,I know he wouldn’t care at all. He seems to very much enjoy saying right now. I was just curious if he wasn’t there and that’s why she brought him. ,,,
,8/15/24,2024-08-15 17:23:59,Incoming,I would say she doesn’t care about what mark thinks. She brought her husband because he is what she cares about. I doubt mark crossed her mind at all ,,,
,8/15/24,2024-08-15 17:28:36,Outgoing,"I don’t think she cares what he thinks, I meant if she would rather be with him if he was going to be there. 

They were just together at RPM and New Zealand was only 2 months ago so I question how much she really “cares” about her husband.",,,
,8/15/24,2024-08-15 17:29:25,Incoming,"O, yea idk. I didn’t realize there were at RPM together ",,,
,8/15/24,2024-08-15 17:31:02,Outgoing,"She sat with him everyday and they went out together the last night. That doesn’t mean they necessarily were having sex, but even if they weren’t, New Zealand was only two months ago. 

So either she met her new husband in the past two months and immediately got married, or she was cheating on him or they have a relationship.",,,
,8/15/24,2024-08-15 17:32:33,Outgoing,"On more important note, remember when we were talking about skin care and how I wanted to find an aesthetician I could trust that could give me a skin care routine?",,,
,8/15/24,2024-08-15 17:33:50,Outgoing,"I used chat gpt instead and was able to upload photos of my skin and asked it for the best skincare routine based on my goals.

So cool!",,,
,8/15/24,2024-08-15 17:34:53,Outgoing,,,,
,8/15/24,2024-08-15 17:36:07,Incoming,She said they used to date years ago. So I am sure they just picked that up ,,,
,8/15/24,2024-08-15 17:36:37,Incoming,That’s a lot of stuff. But awesome it did that ,,,
,8/15/24,2024-08-15 17:37:17,Outgoing,Within the past two months and decided to get married? That would be pretty aggressive. ,,,
,8/15/24,2024-08-15 17:38:35,Incoming,Haha I have no idea ,,,
,8/15/24,2024-08-15 17:39:05,Incoming,I just said that’s awesome and started talking about construction with him ,,,
,8/15/24,2024-08-15 17:40:03,Outgoing,"I had all of it except 2 things. I just never really understood the science behind when to use what so I would use them haphazardly.

The sequence and frequency of each is really important. For example, if you put on the moisturizer first, you’re basically wasting all the other products because the moisturizer acts as a barrier so you’re not even really absorbing them.",,,
,8/15/24,2024-08-15 17:48:11,Incoming,"Hmm, I should do that for mine but make it simpler ",,,
,8/15/24,2024-08-15 18:13:37,Outgoing,"Not simpler, you want the best.",,,
,8/15/24,2024-08-15 18:16:44,Incoming,"I also want something I will actually do. It’s like someone starting to work out for the first time, do you tell them to start off with two a days? Or walk on the treadmill for 30 minutes 3 times a week.",,,
,8/15/24,2024-08-15 18:18:31,Outgoing,"Fine, if you insist. I guess getting you to wash your face with real face wash is a good first step.",,,
,8/15/24,2024-08-15 18:19:10,Incoming,I would agree. Walk before you run. ,,,
,8/15/24,2024-08-15 18:19:25,Outgoing,Lol,,,
,8/15/24,2024-08-15 18:19:44,Outgoing,"Ok, so I’ll order you face wash.",,,
,8/15/24,2024-08-15 18:20:01,Outgoing,Actually you already have that in the shower. I forgot.,,,
,8/15/24,2024-08-15 18:20:27,Incoming,Yea I have the black stuff. Don’t need to buy anything else ,,,
,8/15/24,2024-08-15 18:20:40,Incoming,Put the CC away ,,,
,8/15/24,2024-08-15 18:21:05,Outgoing,Don’t tell me what to do,,,
,8/15/24,2024-08-15 18:21:11,Outgoing,😊,,,
,8/15/24,2024-08-15 18:21:51,Outgoing,I love that face wash. Your face feels so clean after you use it. I’m surprised you don’t like using it.,,,
,8/15/24,2024-08-15 18:23:52,Incoming,I do use it when I am in the shower ,,,
,8/15/24,2024-08-15 18:24:26,Outgoing,That’s like 20 times a day so you should be ready to move on to the more advanced routine.,,,
,8/15/24,2024-08-15 18:24:57,Incoming,If it doesn’t take more time sure ,,,
,8/15/24,2024-08-15 18:25:59,Outgoing,Like putting on a serum in the morning and night?,,,
,8/15/24,2024-08-15 18:35:18,Incoming,Is that the stuff in the green bottle? ,,,
,8/15/24,2024-08-15 18:38:20,Outgoing,That’s hair serum ,,,
,8/15/24,2024-08-15 18:46:35,Incoming,Well I have been putting it on my face ,,,
,8/15/24,2024-08-15 19:01:52,Outgoing,I’m not helping you anymore,,,
,8/15/24,2024-08-15 19:03:55,Incoming,Send me a picture of the stuff your talking about ,,,
,8/15/24,2024-08-15 19:04:29,Outgoing,The green bottle one? ,,,
,8/15/24,2024-08-15 19:05:58,Incoming,Yes,,,
,8/15/24,2024-08-15 19:06:06,Incoming,We may be talking about two different things ,,,
,8/15/24,2024-08-15 20:07:07,Outgoing,Lexi has been driving me insane all day. I am going to have to take her to your place and work. I should have done that 6 hours ago.,,,
,8/15/24,2024-08-15 21:51:24,Incoming,Just barking all the time? Are you going to work at my place or leave her there and go back to yours? ,,,
,8/15/24,2024-08-15 21:54:57,Outgoing,I got her the same dog food I had ordered for Charles and she is obsessed with it and knows I have more in the cabinet so she just kept barking until I would give her more. ,,,
,8/15/24,2024-08-15 21:55:18,Outgoing,She finally stopped after I text you so I’m still at my place. ,,,
,8/15/24,2024-08-15 22:31:29,Incoming,Haha she loves the stuff ,,,
,8/15/24,2024-08-15 22:32:23,Outgoing,Not. Haha. I had to shut her in my bedroom or put her on the counter to get her to quit. And as soon as I let her down she would start again. This has been going on all day off and on.,,,
,8/15/24,2024-08-15 22:33:06,Incoming,Damn that doesn’t sound fun ,,,
,8/15/24,2024-08-15 22:35:50,Outgoing,No. And then she is so cute that I feel bad and want to give her more.,,,
,8/15/24,2024-08-15 22:36:10,Incoming,Well she’s a fat girl ,,,
,8/15/24,2024-08-15 22:36:22,Outgoing,No. Cute. Not fat.,,,
,8/15/24,2024-08-15 22:36:38,Outgoing,Is Jesse enjoying BM?,,,
,8/15/24,2024-08-15 22:36:57,Incoming,"Yes, doesn’t care for the jumping and what not but likes the content ",,,
,8/15/24,2024-08-15 22:38:35,Outgoing,No way. He’s probably just trying to act tough lol. I’ve never met anyone that doesn’t actually like it.,,,
,8/15/24,2024-08-15 22:39:02,Incoming,Haha idk. Just glad he is here ,,,
,8/15/24,2024-08-15 22:52:04,Outgoing,"Tell him that’s how you met me and then maybe he will like it. He just needs to strategically stand in the area next to a girl with big tits, so she purposely presses them into him when she gives him a hug.",,,
,8/15/24,2024-08-15 22:52:44,Incoming,He’s more of a ass guy lol ,,,
,8/15/24,2024-08-15 22:55:49,Outgoing,"Ok, he will have to be more creative with that.",,,
,8/16/24,2024-08-16 00:44:51,Incoming,Haha yes he will ,,,
,8/16/24,2024-08-16 00:49:29,Outgoing,Asstitude per Joseph ,,,
,8/16/24,2024-08-16 00:49:46,Incoming,lol exactly ,,,
,8/16/24,2024-08-16 21:07:57,Incoming,https://www.zillow.com/homedetails/935-21st-Ave-N-Saint-Petersburg-FL-33704/81395358_zpid/?utm_campaign=iosappmessage&utm_medium=referral&utm_source=txtshare,,,
,8/16/24,2024-08-16 21:07:57,Incoming,You see this place ,,,
,8/16/24,2024-08-16 21:34:34,Incoming,https://www.zillow.com/homedetails/614-3rd-Ave-S-Saint-Petersburg-FL-33701/84077978_zpid/?utm_campaign=iosappmessage&utm_medium=referral&utm_source=txtshare,,,
,8/16/24,2024-08-16 21:35:02,Outgoing,I didn’t see that first one you sent. ,,,
,8/16/24,2024-08-16 21:39:01,Incoming,You don’t see it now or you didn’t see it before ,,,
,8/16/24,2024-08-16 21:40:04,Outgoing,I didn’t see it before. I’m pretty sure I looked at the second one you sent but didn’t save it because it didn’t have a yard. ,,,
,8/16/24,2024-08-16 21:49:57,Incoming,What are you up to? ,,,
,8/16/24,2024-08-16 21:59:08,Outgoing,Hiding Lexi’s dog food around the house so she has to search for it. ,,,
,8/16/24,2024-08-16 21:59:30,Outgoing,And finishing some work. ,,,
,8/16/24,2024-08-16 22:02:10,Incoming,lol,,,
,8/16/24,2024-08-16 22:02:36,Outgoing,That didn’t work. She found it all and now she is barking again. ,,,
,8/16/24,2024-08-16 22:04:39,Outgoing,,,,
,8/16/24,2024-08-16 22:07:37,Incoming,Fat girl needs that food ,,,
,8/16/24,2024-08-16 22:08:24,Outgoing,I think that stuff is part crack. ,,,
,8/16/24,2024-08-16 22:37:48,Incoming,It’s called Barack lol ,,,
,8/17/24,2024-08-17 22:07:59,Incoming,,,,
,8/17/24,2024-08-17 22:08:36,Outgoing,Storybrand?,,,
,8/17/24,2024-08-17 22:08:45,Incoming,Yep,,,
,8/17/24,2024-08-17 22:08:59,Outgoing,Why did you send that though?,,,
,8/17/24,2024-08-17 22:09:13,Incoming,I thought you liked him ,,,
,8/17/24,2024-08-17 22:09:37,Outgoing,I do like him.,,,
,8/17/24,2024-08-17 22:10:00,Incoming,That’s why I sent it to you ,,,
,8/17/24,2024-08-17 22:11:00,Outgoing,I thought there was something specific about what he was talking about that made you send it.,,,
,8/17/24,2024-08-17 22:11:35,Incoming,No just knew you liked him ,,,
,8/17/24,2024-08-17 22:12:55,Incoming,You working? ,,,
,8/17/24,2024-08-17 22:13:04,Outgoing,Yes,,,
,8/18/24,2024-08-18 14:01:59,Incoming,Did you take off your read receipts for me? ,,,
,8/18/24,2024-08-18 14:05:40,Outgoing,No,,,
,8/18/24,2024-08-18 14:05:50,Outgoing,Why? ,,,
,8/18/24,2024-08-18 14:06:30,Incoming,It doesn’t show them anymore ,,,
,8/18/24,2024-08-18 14:09:27,Outgoing,And what made you randomly ask that? You haven’t even text me today.,,,
,8/18/24,2024-08-18 14:10:25,Incoming,I went to look if you read my Instagram message I sent back to you and noticed the read thing wasn’t there then went and looked at the text and noticed those weren’t showing as well ,,,
,8/18/24,2024-08-18 14:12:28,Outgoing,,,,
,8/18/24,2024-08-18 14:12:28,Outgoing,Mine doesn’t show if you read it or not on Instagram. ,,,
,8/18/24,2024-08-18 14:13:43,Incoming,I believe that is because you removed the reads on your Instagram so it goes both ways. I am able to see when other people read my Instagram messages. ,,,
,8/18/24,2024-08-18 14:20:09,Outgoing,Ok,,,
,8/18/24,2024-08-18 14:21:35,Outgoing,,,,
,8/18/24,2024-08-18 14:28:53,Outgoing,I just checked and I did have read receipts turned off so I must have accidentally toggled it off when I was looking for a photo or something that you sent.,,,
,8/18/24,2024-08-18 15:14:43,Incoming,Your boy dean just got done speaking ,,,
,8/18/24,2024-08-18 15:15:58,Incoming,"I didn’t think to ask you about your day, it doesn’t feel like the afternoon. How is your day going? ",,,
,8/18/24,2024-08-18 15:59:52,Outgoing,What did he pitch? ,,,
,8/18/24,2024-08-18 16:07:31,Outgoing,I like that his kids and wife go with him whenever he travels. ,,,
,8/18/24,2024-08-18 16:08:56,Incoming,He just pitched buying more tony stuff ,,,
,8/18/24,2024-08-18 16:09:12,Incoming,Didn’t have anything really as far as content ,,,
,8/18/24,2024-08-18 16:43:06,Incoming,How is your day? ,,,
,8/18/24,2024-08-18 16:44:03,Outgoing,"It’s good. Just doing household things like laundry, cleaning laundry, ect. ",,,
,8/18/24,2024-08-18 16:54:43,Incoming,You said laundry twice ,,,
,8/18/24,2024-08-18 16:57:35,Outgoing,I meant cleaning,,,
,8/18/24,2024-08-18 17:11:20,Incoming,Okay I will let you focus on that ,,,
,8/18/24,2024-08-18 17:11:50,Outgoing,Is something wrong?,,,
,8/18/24,2024-08-18 17:21:42,Incoming,"No, I asked you how your day was and you replied with a statement of how it is. Nothing else to say, I’m not going to just follow up with questions to statement response ",,,
,8/18/24,2024-08-18 17:22:35,Outgoing,If you want to talk then have a real conversation. I’m not good at small talk. ,,,
,8/18/24,2024-08-18 17:23:31,Outgoing,I figured you are at bm and are busy so we can talk when you have time. ,,,
,8/19/24,2024-08-19 09:14:46,Outgoing,,,,
,8/19/24,2024-08-19 09:14:46,Outgoing,This isn’t yours is it? ,,,
,8/19/24,2024-08-19 11:59:31,Incoming,I think so maybe ,,,
,8/19/24,2024-08-19 12:01:19,Outgoing,Ok. I’ll let my sister know. I didn’t remember you having a theory shirt so I wasn’t sure. ,,,
,8/19/24,2024-08-19 12:07:52,Incoming,I don’t know either to be honest ,,,
,8/19/24,2024-08-19 12:07:55,Incoming,What size it is ,,,
,8/19/24,2024-08-19 12:16:42,Outgoing,I asked her. ,,,
,8/19/24,2024-08-19 12:17:47,Incoming,Thank You ,,,
,8/19/24,2024-08-19 13:01:09,Outgoing,,,,
,8/19/24,2024-08-19 13:01:09,Outgoing,I just need to reauthenticate Keap which will take a minute,,,
,8/19/24,2024-08-19 13:03:46,Incoming,What do you mean ,,,
,8/19/24,2024-08-19 13:04:09,Incoming,Did you mean to send that to Chris? ,,,
,8/19/24,2024-08-19 13:07:13,Outgoing,Yes,,,
,8/19/24,2024-08-19 13:13:51,Incoming,Cool,,,
,8/19/24,2024-08-19 13:14:25,Incoming,Get someone else to handle it ,,,
,8/19/24,2024-08-19 13:17:51,Outgoing,Keap phased out there legacy api which requires authenticating any integrations with the new api so every client needs it done.,,,
,8/19/24,2024-08-19 13:18:56,Incoming,Awesome ,,,
,8/19/24,2024-08-19 13:19:21,Outgoing,And that’s a problem for you? ,,,
,8/19/24,2024-08-19 13:21:22,Incoming,How do you fuck up texting your x boyfriend and text me,,,
,8/19/24,2024-08-19 13:23:19,Outgoing,Because you were the last person I text from my computer and I was taking a screenshot and sent the text. ,,,
,8/19/24,2024-08-19 13:27:36,Incoming,Dont fuck up and confuse me for Chris anymore ,chris,,
,8/19/24,2024-08-19 13:28:00,Outgoing,Don’t talk to me like that. ,,,
,8/19/24,2024-08-19 13:28:31,Outgoing,I didn’t confuse you and you know that. ,,,
,8/19/24,2024-08-19 13:28:34,Incoming,I am being direct with you. Don’t confuse me with your X boyfriend ,,,
,8/19/24,2024-08-19 13:29:03,Incoming,You did because you sent me that text. You thought you were messaging your X boyfriend but messaged me. ,,,
,8/19/24,2024-08-19 13:29:48,Outgoing,Ok Brandon. ,,,
,8/19/24,2024-08-19 13:34:33,Incoming,I know I am controlling and it isn’t fair. I completely understand why you would be angry. ,,,
,8/19/24,2024-08-19 13:45:34,Outgoing,I’m not angry. I just said not to talk to me like that. ,,,
,8/19/24,2024-08-19 20:41:02,Outgoing,When are you planning on coming back to Tampa? ,,,
,8/19/24,2024-08-19 20:42:34,Incoming,Friday,,,
,8/19/24,2024-08-19 20:44:25,Incoming,Tampa for two weeks. Flying to Indy week of the 9th,,,
,8/19/24,2024-08-19 20:46:48,Outgoing,That’s good you’ll actually be here for more than a few days. ,,,
,8/19/24,2024-08-19 20:50:00,Incoming,"Yea, I am laying it all out I am doing two weeks in Tampa one week in Indy for the rest of the year. Setting all my meetings and not taking last minute ones ",,,
,8/19/24,2024-08-19 21:23:56,Incoming,What brought up that question? ,,,
,8/19/24,2024-08-19 21:25:37,Outgoing,Because I missed you. ,,,
,8/19/24,2024-08-19 21:28:34,Incoming,Loved “Because I missed you. ”,,,
,8/19/24,2024-08-19 23:58:18,Incoming,https://search.app/Dr46NHrLDUZ4UdnB9,,,
,8/19/24,2024-08-19 23:58:18,Incoming,Create breathtaking images with FLUX.1 online. Elevate your visual content with a game-changing AI model that brings unparalleled detail and innovation.,,,
,8/20/24,2024-08-20 12:36:46,Incoming,You have a package ,,,
,8/20/24,2024-08-20 12:37:02,Outgoing,Oh yea?,,,
,8/20/24,2024-08-20 12:37:14,Incoming,Yes,,,
,8/20/24,2024-08-20 13:14:12,Outgoing,,,,
,8/20/24,2024-08-20 13:14:32,Outgoing,,,,
,8/20/24,2024-08-20 13:14:32,Outgoing,,,,
,8/20/24,2024-08-20 13:21:13,Outgoing,How did you find that company?,,,
,8/20/24,2024-08-20 13:25:06,Notification,Brandon Clymer kept an audio message from you.,,,
,8/20/24,2024-08-20 13:25:06,Notification,Brandon Clymer kept an audio message from you.,,,
,8/20/24,2024-08-20 13:25:22,Incoming,The CEO spoke at BM. Then I met her in the airport ,,,
,8/20/24,2024-08-20 15:41:08,Outgoing,Oh that’s so cool! I asked because I was impressed with the presentation and the copy on the flyer they sent. ,,,
,8/20/24,2024-08-20 15:42:41,Incoming,Yes they do a great job ,,,
,8/20/24,2024-08-20 21:42:09,Incoming,I land at 10 Friday,,,
,8/20/24,2024-08-20 21:42:30,Outgoing,Sounds good,,,
,8/20/24,2024-08-20 21:42:36,Incoming,Cool,,,
,8/20/24,2024-08-20 21:42:44,Outgoing,Cool,,,
,8/20/24,2024-08-20 21:46:26,Incoming,You got quite a bit of comments and likes on your picture of you and Bri ,,,
,8/20/24,2024-08-20 21:47:03,Outgoing,That’s nice,,,
,8/20/24,2024-08-20 21:47:52,Incoming,You say that like you don’t know? ,,,
,8/20/24,2024-08-20 21:48:56,Outgoing,I saw 4 comments the last time I looked.,,,
,8/20/24,2024-08-20 21:49:22,Incoming,It says 5 but it only shows me 4 when I look,,,
,8/20/24,2024-08-20 21:52:48,Outgoing,Now it says 8 because I replied back.,,,
,8/20/24,2024-08-20 21:53:30,Outgoing,Why do you say that’s a lot of comments and likes? That’s less than usual. ,,,
,8/20/24,2024-08-20 21:55:24,Incoming,It’s on par with what you got on your last couple post ,,,
,8/20/24,2024-08-20 21:56:22,Outgoing,Yea but it’s still less. That why I was confused when you said that. ,,,
,8/20/24,2024-08-20 21:57:25,Incoming,Who’s the guy wanting to go to Jackson hole with you? ,,,
,8/20/24,2024-08-20 21:58:21,Outgoing,Christian. You met him at the wedding. ,,,
,8/20/24,2024-08-20 21:58:26,Incoming,,,,
,8/20/24,2024-08-20 21:58:26,Incoming,Why does it say null? ,,,
,8/20/24,2024-08-20 21:59:02,Outgoing,I don’t know,,,
,8/20/24,2024-08-20 21:59:17,Incoming,What does it show on yours ,,,
,8/20/24,2024-08-20 21:59:52,Outgoing,I don’t know,,,
,8/20/24,2024-08-20 21:59:59,Outgoing,Google it,,,
,8/20/24,2024-08-20 22:00:15,Outgoing,Oh wait I read that wrong,,,
,8/20/24,2024-08-20 22:00:36,Outgoing,I thought you said why does it show on yours ,,,
,8/20/24,2024-08-20 22:01:22,Incoming,Screen shot yours,,,
,8/20/24,2024-08-20 22:01:47,Outgoing,,,,
,8/20/24,2024-08-20 22:01:47,Outgoing,"That’s weird, it’s showing null on mine too. ",,,
,8/20/24,2024-08-20 22:02:52,Incoming,Yours also says 8 comments when I look it says 9,,,
,8/20/24,2024-08-20 22:03:00,Incoming,Must be some kind of glitch ,,,
,8/20/24,2024-08-20 22:04:03,Outgoing,,,,
,8/20/24,2024-08-20 22:04:03,Outgoing,That’s weird. It’s showing null from your comments on your last post too. ,,,
,8/20/24,2024-08-20 22:05:12,Incoming,Yes looks like it’s the same on all the posts ,,,
,8/20/24,2024-08-20 22:06:08,Outgoing,Why did you bring up the number of comment thing to begin with? ,,,
,8/20/24,2024-08-20 22:06:40,Incoming,"I told you, it thought it was good engagement ",,,
,8/20/24,2024-08-20 22:07:25,Outgoing,No the  “It says 5 but it only shows me 4 when I look”,,,
,8/20/24,2024-08-20 22:07:45,Incoming,O cause I am weird and notice the little details ,,,
,8/20/24,2024-08-20 22:10:04,Incoming,You clearly think it’s something else though ,,,
,8/20/24,2024-08-20 22:11:21,Outgoing,It was random which is why I asked. ,,,
,8/20/24,2024-08-20 22:14:42,Incoming,Did you do any edits to the video of me fucking you? ,,,
,8/20/24,2024-08-20 22:15:47,Outgoing,"No, why? We did that on your phone.",,,
,8/20/24,2024-08-20 22:16:03,Outgoing,I don’t know why you didn’t send me that one instead. ,,,
,8/20/24,2024-08-20 22:16:40,Incoming,What do you mean? Which one did I not send ,,,
,8/20/24,2024-08-20 22:17:05,Outgoing,The one of them together instead of the three different files. ,,,
,8/20/24,2024-08-20 22:17:32,Incoming,O cause I thought you wanted them separate so you could do your editing or something ,,,
,8/21/24,2024-08-21 07:50:05,Outgoing,Hi :),,,
,8/21/24,2024-08-21 07:54:19,Incoming,Good morning ,,,
,8/21/24,2024-08-21 08:34:17,Incoming,You fall back asleep ,,,
,8/21/24,2024-08-21 09:22:39,Incoming,Did you mean to text me? ,,,
,8/21/24,2024-08-21 09:46:41,Outgoing,Yes I did mean to text you.,,,
,8/21/24,2024-08-21 09:46:55,Outgoing,And yes I fell back asleep. ,,,
,8/21/24,2024-08-21 10:50:20,Outgoing,"Can you overnight me adderal for Thursday and Friday?

I’m sorry",,,
,8/21/24,2024-08-21 10:52:33,Outgoing,That’s why I text you earlier and then I was seeing if I could not have it.,,,
,8/21/24,2024-08-21 10:54:03,Outgoing,And that didn’t go well,,,
,8/21/24,2024-08-21 10:54:37,Incoming,You text me earlier to get adderal? ,,,
,8/21/24,2024-08-21 10:56:26,Outgoing,When I said hi,,,
,8/21/24,2024-08-21 10:56:46,Outgoing,But then I didn’t ask you,,,
,8/21/24,2024-08-21 10:56:56,Incoming,"Haha, I thought you woke up and just thought about me and were excited to text me ",,,
,8/21/24,2024-08-21 10:57:16,Outgoing,That too,,,
,8/21/24,2024-08-21 11:13:12,Incoming,Did you already ask Chris for some? ,chris,,
,8/21/24,2024-08-21 11:13:31,Outgoing,No,,,
,8/21/24,2024-08-21 11:16:21,Outgoing,Then I would have to go over there and then I would have to tell you and then it would cause all that drama and I don’t have the energy for that.,,,
,8/21/24,2024-08-21 11:20:47,Incoming,I think I have some at my apartment don’t I ,,,
,8/21/24,2024-08-21 11:21:21,Outgoing,"Ok, I’ll check. Where would it be? ",,,
,8/21/24,2024-08-21 11:21:43,Incoming,Somewhere in the bathroom probably ,,,
,8/21/24,2024-08-21 11:28:50,Incoming,Yes I would prefer you not talk to him which includes asking for adderall ,,,
,8/21/24,2024-08-21 11:31:52,Outgoing,What makes you think that you have some there? Because last time you were here you got your prescription filled at Publix but you took them with you. ,,,
,8/21/24,2024-08-21 11:32:45,Incoming,"I thought I had a second bottle, but I don’t know. It was just a guess ",,,
,8/21/24,2024-08-21 11:33:35,Outgoing,I’ll look but I’m pretty positive you do not.,,,
,8/21/24,2024-08-21 11:34:22,Incoming,I thought I had 30s somewhere. All I have in my bag is the 20s from Publix,,,
,8/21/24,2024-08-21 12:03:31,Incoming,Did you block me on Facebook? ,,,
,8/21/24,2024-08-21 12:04:22,Outgoing,I did the same time I did Instagram but I unblocked you. ,,,
,8/21/24,2024-08-21 12:05:36,Incoming,It shows you still have me blocked ,,,
,8/21/24,2024-08-21 12:05:44,Incoming,Are you able to see my profile ,,,
,8/21/24,2024-08-21 13:32:40,Outgoing,No I can’t. If I had you blocked I should be able to see yours. ,,,
,8/21/24,2024-08-21 13:33:12,Incoming,Go look at who you have blocked. ,,,
,8/21/24,2024-08-21 13:33:49,Outgoing,I found it. I unblocked you. ,,,
,8/21/24,2024-08-21 13:48:41,Outgoing,You don’t have adderall here. ,,,
,8/21/24,2024-08-21 14:33:01,Incoming,"Okay, must be at the Indy house then. ",,,
,8/21/24,2024-08-21 14:38:55,Outgoing,I looked and don’t see any country concerts this weekend in Tampa.,,,
,8/21/24,2024-08-21 15:25:25,Incoming,"Okay, so you want me to send you adderal then? ",,,
,8/21/24,2024-08-21 15:28:56,Outgoing,If you can please,,,
,8/21/24,2024-08-21 15:51:44,Incoming,Want anything else ,,,
,8/21/24,2024-08-21 15:52:07,Outgoing,🥩 ,,,
,8/21/24,2024-08-21 15:52:26,Outgoing,A love letter 💌 ,,,
,8/21/24,2024-08-21 15:52:37,Outgoing,👜 ,,,
,8/21/24,2024-08-21 15:53:01,Incoming,I wrote you a nice thing on your Instagram post. You didn’t like it? ,,,
,8/21/24,2024-08-21 15:56:00,Outgoing,I just liked it. ,,,
,8/21/24,2024-08-21 15:56:22,Incoming,Did you reply to it? That helps with engagement ,,,
,8/21/24,2024-08-21 15:57:33,Outgoing,I just responded to your Instagram message but it was addressed to Bree so I didn’t think to respond to it.,,,
,8/21/24,2024-08-21 15:58:27,Incoming,"What, you wouldn’t want to say something like thanks babe love you for coming can’t wait till our or something. ",,,
,8/21/24,2024-08-21 16:00:54,Incoming,,,,
,8/21/24,2024-08-21 16:00:54,Incoming,That’s weird it says two comments again.  It it only shows one. Is that what yours shows? ,,,
,8/21/24,2024-08-21 16:01:16,Outgoing,I can definitely say something of that nature. I just didn’t think about it.,,,
,8/21/24,2024-08-21 16:03:17,Outgoing,Why don’t you just ask what you really want to ask. ,,,
,8/21/24,2024-08-21 16:03:43,Incoming,On a job site ,,,
,8/21/24,2024-08-21 16:04:12,Outgoing,You have a lot of time to be looking at Instagram if your on a job site ,,,
,8/21/24,2024-08-21 16:05:42,Incoming,What do you mean ask what I want to ask? I just did ,,,
,8/21/24,2024-08-21 16:06:54,Outgoing,"This would be an example of what we were talking about the other night about what gives me anxiety.

You comment on my post and I don’t respond the way you think I should have and get upset.

Reverse scenario I comment on your post and you don’t respond but I don’t take that personally in anyway.",,,
,8/21/24,2024-08-21 16:09:34,Outgoing,Mine shows 2,,,
,8/21/24,2024-08-21 16:09:51,Incoming,Yours shows two comments but you can only see one? ,,,
,8/21/24,2024-08-21 16:09:59,Outgoing,I can see two,,,
,8/21/24,2024-08-21 16:10:22,Incoming,"That’s weird, I wonder why I only see one. ",,,
,8/21/24,2024-08-21 16:12:06,Outgoing,Does that resonate at all?,,,
,8/21/24,2024-08-21 16:12:43,Incoming,"Usually you would always be one to respond to a comment, it is surprising why you wouldn’t want to comment. ",,,
,8/21/24,2024-08-21 16:12:59,Outgoing,I answered why. ,,,
,8/21/24,2024-08-21 16:14:40,Incoming,Okay. ,,,
,8/21/24,2024-08-21 16:16:15,Outgoing,"Another example, I never bitched about you taking down the picture of us or not having any of us on there. When and if you want to, you will.

It feels like you over analyze everything and take it as a personal  attack. ",,,
,8/21/24,2024-08-21 16:17:49,Incoming,I did put a picture of us up. From New Zealand. You didn’t like it or comment ,,,
,8/21/24,2024-08-21 16:20:17,Outgoing,I just liked that post.,,,
,8/21/24,2024-08-21 16:22:58,Outgoing,I didn’t like it before because you made such a big deal about the Instagram thing and said the one of us from the lightning game didn’t count because it was a carousel post even though the one of us was the primary one. ,,,
,8/21/24,2024-08-21 16:24:00,Incoming,It seems like when I asked you about the comments thing that was a trigger. Because you said ask what you want to really ask. What is it about that statement that triggered you? ,,,
,8/21/24,2024-08-21 16:24:05,Outgoing,"So it was comical to me that you did the same thing. But again, I didn’t mention or over analyze it because it’s not important. ",,,
,8/21/24,2024-08-21 16:25:42,Outgoing,Because you did the same thing yesterday. And it was the stacking of the other questions. Call me if you actually want to talk.,,,
,8/21/24,2024-08-21 16:26:52,Incoming,"But yesterday it was messed up, you were seeing the same thing on yours. You sent me a screen shot. Today you said you can see my comment and someone else’s. But I am not able to see the other persons comment",,,
,8/21/24,2024-08-21 16:27:18,Outgoing,"Ok, what’s the point and why do you care? ",,,
,8/21/24,2024-08-21 16:28:02,Incoming,Why wouldn’t I care? You had me blocked on FB as of this morning.,,,
,8/21/24,2024-08-21 16:28:35,Incoming,Don’t you want to know why it says that? ,,,
,8/21/24,2024-08-21 16:29:21,Outgoing,Well if you didn’t end the relationship 4  times in 6 weeks you wouldn’t have been blocked.,,,
,8/21/24,2024-08-21 16:29:52,Incoming,Aren’t you curious why it says that on mine? ,,,
,8/21/24,2024-08-21 16:30:05,Outgoing,No I am not,,,
,8/21/24,2024-08-21 16:30:50,Incoming,Haha well I am. I want to be able to see the comments on your photos so I can engage like a couple ,,,
,8/21/24,2024-08-21 16:31:55,Incoming,Did you like and comment on the other comment? ,,,
,8/21/24,2024-08-21 16:32:37,Outgoing,I liked it the same time I liked yours when you brought the comments to my attention. ,,,
,8/21/24,2024-08-21 16:33:21,Incoming,Well lucky I told you to do it. Why wouldn’t I be able to see them? ,,,
,8/21/24,2024-08-21 16:33:35,Incoming,I’m not face timing you right now I’m with Jesse ,,,
,8/21/24,2024-08-21 16:34:17,Outgoing,Then be present with him instead of texting me if you can’t answer the phone. ,,,
,8/21/24,2024-08-21 16:35:24,Outgoing,I don’t see how you’re too busy to answer but have text for the last 35 minutes about Instagram comments.,,,
,8/21/24,2024-08-21 16:36:04,Incoming,Why is this so upsetting to you that I am asking about the comments? Don’t you want me to be able to see them? ,,,
,8/21/24,2024-08-21 16:36:38,Outgoing,Of course,,,
,8/21/24,2024-08-21 16:37:12,Outgoing,I’m going back to work now. You can call me when you’re free if you want to continue talking about it. ,,,
,8/21/24,2024-08-21 16:38:16,Incoming,I just don’t understand why you would get so angry. Can you send me a screen shot of the comments you see. I will do some digging to see if there is a setting or something ,,,
,8/21/24,2024-08-21 16:38:26,Outgoing,I’m not angry,,,
,8/21/24,2024-08-21 16:38:48,Incoming,"Okay, shoot me the pic and I will dig into it and report back ",,,
,8/21/24,2024-08-21 16:38:48,Outgoing,You can call me,,,
,8/21/24,2024-08-21 16:39:15,Incoming,Call you about what? ,,,
,8/21/24,2024-08-21 16:39:27,Outgoing,This entire conversation. ,,,
,8/21/24,2024-08-21 16:39:58,Incoming,"There is nothing to talk about, I am trying to figure out the problem lol. ",,,
,8/21/24,2024-08-21 16:40:04,Outgoing,Ok,,,
,8/21/24,2024-08-21 16:40:29,Incoming,Send me that screen shot I will dive into it ,,,
,8/21/24,2024-08-21 16:41:25,Outgoing,,,,
,8/21/24,2024-08-21 16:41:41,Incoming,Now it all makes sense ,,,
,8/21/24,2024-08-21 16:42:40,Outgoing,What does?,,,
,8/21/24,2024-08-21 16:43:04,Incoming,Everything. This entire conversation. ,,,
,8/21/24,2024-08-21 16:43:52,Outgoing,Really?,,,
,8/21/24,2024-08-21 16:44:08,Outgoing,,,,
,8/21/24,2024-08-21 16:44:08,Outgoing,The same conversation as yesterday?,,,
,8/21/24,2024-08-21 16:44:46,Incoming,Haha no. ,,,
,8/21/24,2024-08-21 16:46:02,Incoming,On the other line. ,,,
,8/21/24,2024-08-21 16:48:02,Incoming,On the other line. ,,,
,8/21/24,2024-08-21 16:48:12,Incoming,On the other line. ,,,
,8/21/24,2024-08-21 16:49:15,Incoming,On the other line. ,,,
,8/21/24,2024-08-21 18:11:36,Incoming,Done,,,
,8/21/24,2024-08-21 18:12:18,Outgoing,No way!,,,
,8/21/24,2024-08-21 18:13:12,Outgoing,I love you,,,
,8/21/24,2024-08-21 18:14:45,Incoming,You’re talking to Brandon.  Not the adderal ,,,
,8/21/24,2024-08-21 18:14:54,Outgoing,I’m aware,,,
,8/21/24,2024-08-21 18:18:48,Incoming,Your welcome. ,,,
,8/21/24,2024-08-21 19:14:28,Incoming,I know you don’t want me involved in your finances or business but you missed CC payments ,,,
,8/21/24,2024-08-21 19:16:51,Outgoing,Thank you. I’ll pay them.,,,
,8/21/24,2024-08-21 19:17:30,Outgoing,,,,
,8/21/24,2024-08-21 19:17:30,Outgoing,It’s interesting that Sage is stepping into the forefront of UHPW suddenly. ,,,
,8/21/24,2024-08-21 19:18:04,Incoming,Cool,,,
,8/21/24,2024-08-21 19:18:15,Outgoing,I wonder what type of terms Karissa had with them for UHPW. ,,,
,8/21/24,2024-08-21 19:19:57,Outgoing,They are doing that She’s Unstoppable Summit now that Tony was talking about at RPM. ,,,
,8/21/24,2024-08-21 19:23:09,Incoming,Idk,,,
,8/21/24,2024-08-21 19:24:26,Outgoing,You don’t know what?,,,
,8/21/24,2024-08-21 19:25:49,Outgoing,I also never said you couldn’t be involved in my finances.,,,
,8/21/24,2024-08-21 19:32:16,Incoming,Are you going to pay the 25k for plat and happiness?,,,
,8/21/24,2024-08-21 19:33:02,Outgoing,Trying to,,,
,8/21/24,2024-08-21 19:33:29,Incoming,How close are you to the 25k?,,,
,8/21/24,2024-08-21 19:36:55,Outgoing,Not close. I just invoiced $9k and I have $7.5k coming in 3 weeks for the second half of that most recent new client. But that money just goes to general expenses and credit card payments.,,,
,8/21/24,2024-08-21 19:37:20,Outgoing,Why are you asking?,,,
,8/21/24,2024-08-21 19:37:21,Incoming,Who was the 9k for?,,,
,8/21/24,2024-08-21 19:38:16,Outgoing,Random client stuff I already should have invoiced for. ,,,
,8/21/24,2024-08-21 22:18:51,Outgoing,Do you know what time the FedEx is supposed to get here?,,,
,8/21/24,2024-08-21 22:19:33,Incoming,"No, the front desk may know what time they usually deliver ",,,
,8/21/24,2024-08-21 22:20:15,Outgoing,You would have had to select morning or evening for overnight,,,
,8/21/24,2024-08-21 22:20:37,Incoming,It just said before noon ,,,
,8/21/24,2024-08-21 22:20:45,Incoming,So technically morning ,,,
,8/21/24,2024-08-21 22:20:58,Outgoing,Ok. Thank you. ,,,
,8/21/24,2024-08-21 22:21:05,Incoming,Welcome ,,,
,8/21/24,2024-08-21 22:21:26,Incoming,Was my apartment needing cleaned? ,,,
,8/21/24,2024-08-21 22:21:41,Outgoing,No,,,
,8/21/24,2024-08-21 22:22:03,Incoming,"Really, no dirty laundry or dishes. I thought I left some when we left ",,,
,8/21/24,2024-08-21 22:22:55,Outgoing,I don’t know about laundry. I don’t think there were any dishes in the sink. I don’t know if you had dirty dishes in the dishwasher. ,,,
,8/21/24,2024-08-21 22:23:08,Incoming,Was the bed made? ,,,
,8/21/24,2024-08-21 22:23:35,Outgoing,My side was :),,,
,8/21/24,2024-08-21 22:23:49,Incoming,lol okay I will have the cleaner done ,,,
,8/21/24,2024-08-21 22:23:52,Incoming,Cone ,,,
,8/21/24,2024-08-21 22:24:48,Outgoing,You’re going to get right into bed when you get home anyway. ,,,
,8/21/24,2024-08-21 22:29:31,Incoming,No I won’t ,,,
,8/21/24,2024-08-21 22:29:53,Incoming,But when I do I want it made and my cloths clean and dishes clean ,,,
,8/21/24,2024-08-21 22:30:46,Outgoing,That’s what you did last time you flew in late.,,,
,8/21/24,2024-08-21 22:31:28,Incoming,Do you want me to go right to bed ,,,
,8/21/24,2024-08-21 22:41:36,Outgoing,No,,,
,8/22/24,2024-08-22 04:31:08,Incoming,Okay what do you want to do ,,,
,8/22/24,2024-08-22 10:05:20,Incoming,,,,
,8/22/24,2024-08-22 11:26:01,Incoming,Don’t worry about trying to get in to the website ,,,
,8/22/24,2024-08-22 11:26:04,Outgoing,"It’s not letting me login and when I try to reset my password nothing is coming to my email. 

Doesn’t AJ have access too?",,,
,8/22/24,2024-08-22 11:26:36,Incoming,"He does, I just got with tech support. They did two factor authentication so the unlocked it now ",,,
,8/22/24,2024-08-22 11:27:19,Outgoing,The tracking number says it’s still in Memphis and isn’t scheduled until the end of day.,,,
,8/22/24,2024-08-22 11:27:37,Incoming,I paid to have it delivered by 12 today,,,
,8/22/24,2024-08-22 11:27:43,Incoming,You may have to call them ,,,
,8/22/24,2024-08-22 12:16:27,Incoming,What did they say? ,,,
,8/22/24,2024-08-22 16:54:57,Incoming,Check out that video I just emailed you ,,,
,8/22/24,2024-08-22 19:09:38,Incoming,,,,
,8/22/24,2024-08-22 19:13:07,Outgoing,That’s really good! I’m glad you are doing that. ,,,
,8/22/24,2024-08-22 19:14:07,Incoming,"Yea, I just have to keep doing it. I also need to get somewhere with a better background ",,,
,8/22/24,2024-08-22 19:16:14,Outgoing,There’s an ai tool that changes eye direction so it doesn’t look like you’re reading a script. ,,,
,8/22/24,2024-08-22 19:17:01,Incoming,What? I need that tool. What is it? Can it edit this video? ,,,
,8/22/24,2024-08-22 19:17:20,Outgoing,Yes you can,,,
,8/22/24,2024-08-22 19:17:37,Incoming,Can you share the tool with me? ,,,
,8/22/24,2024-08-22 19:17:46,Outgoing,Yes,,,
,8/22/24,2024-08-22 19:18:00,Incoming,Thank you. ,,,
,8/22/24,2024-08-22 19:20:43,Incoming,What is it called?,,,
,8/22/24,2024-08-22 19:21:08,Outgoing,Descript,,,
,8/22/24,2024-08-22 19:21:21,Incoming,Thank you ,,,
,8/22/24,2024-08-22 19:21:56,Outgoing,https://www.descript.com/eye-contact,,,
,8/22/24,2024-08-22 19:22:05,Incoming,Yep on the website now ,,,
,8/22/24,2024-08-22 19:22:08,Incoming,Do you use it?,,,
,8/22/24,2024-08-22 19:22:39,Outgoing,I have used other features but I haven’t used the eye contact part ,,,
,8/22/24,2024-08-22 19:25:03,Incoming,"Megan, an Uber gift from Brandon is coming your way!",,,
,8/22/24,2024-08-22 19:25:05,Incoming,https://www.ubereats.com/giftcard/redeem?eatsOrderUuid=60d98c2c-34a8-4b4b-b651-907136bdbfd2&nocache=true,,,
,8/22/24,2024-08-22 19:49:09,Incoming,Thank You Babe ,,,
,8/22/24,2024-08-22 20:20:32,Incoming,Did it show up? ,,,
,8/22/24,2024-08-22 20:20:54,Outgoing,Yes :),,,
,8/22/24,2024-08-22 20:21:05,Outgoing,I’m eating it now ,,,
,8/22/24,2024-08-22 20:21:18,Incoming,👍 ,,,
,8/22/24,2024-08-22 20:21:22,Outgoing,Thank you!,,,
,8/22/24,2024-08-22 20:21:36,Outgoing,I’m eating it in bed,,,
,8/22/24,2024-08-22 20:21:51,Incoming,Appreciation… ,,,
,8/22/24,2024-08-22 20:22:04,Incoming,Your a animal ,,,
,8/22/24,2024-08-22 20:27:03,Incoming,This weekend bring your ring light over and I want to make a porno with you. ,,,
,8/22/24,2024-08-22 20:27:21,Incoming,Do your make up and everything and we will make it awesome ,,,
,8/22/24,2024-08-22 20:27:45,Incoming,Start off with a massage like last time and turn into you getting your brains fucked out of you ,,,
,8/22/24,2024-08-22 20:30:04,Outgoing,Ok :),,,
,8/22/24,2024-08-22 20:30:33,Incoming,I will fuck you in the ass this weekend to. Put a fat load in it ,,,
,8/22/24,2024-08-22 20:31:02,Outgoing,What makes you want to do that?,,,
,8/22/24,2024-08-22 20:31:26,Incoming,Because your body is my sex toy and it’s been a while sense I have done that ,,,
,8/22/24,2024-08-22 20:32:53,Outgoing,Yes it is,,,
,8/22/24,2024-08-22 20:33:02,Outgoing,Yours do whatever you please ,,,
,8/22/24,2024-08-22 20:33:36,Incoming,For the porno we won’t do anal. I just want to make you squirt everywhere. ,,,
,8/22/24,2024-08-22 20:35:23,Incoming,Get a great shot of you laying on your back with your legs spread and just watch you squirt everywhere ,,,
,8/22/24,2024-08-22 20:36:37,Outgoing,You’re good at that,,,
,8/22/24,2024-08-22 20:36:59,Incoming,Yes I am. ,,,
,8/22/24,2024-08-22 20:37:30,Incoming,Then I will cum all over your face for the ending. Let you lick the cum off my cock ,,,
,8/22/24,2024-08-22 20:38:18,Outgoing,Is your dick hard yet?,,,
,8/22/24,2024-08-22 20:40:35,Incoming,"Yes it is, I wish you were here. ",,,
,8/22/24,2024-08-22 20:41:43,Outgoing,Me too,,,
,8/22/24,2024-08-22 20:42:29,Incoming,Haha I am going to fuck you so hard. Your pussy is going to be sore as shit. ,,,
,8/22/24,2024-08-22 20:42:52,Incoming,Bring all that leather stuff over too. So I can tie you up and fuck you as much as I want ,,,
,8/22/24,2024-08-22 20:43:12,Outgoing,Loved “Bring all that leather stuff over too. So I can ti…”,,,
,8/22/24,2024-08-22 20:43:17,Incoming,Treat you like a fuck doll ,,,
,8/22/24,2024-08-22 20:45:40,Incoming,I don’t know if I will even untie you when I am done. I may just leave you there for a bit till I’m ready to come fuck you again ,,,
,8/22/24,2024-08-22 20:46:03,Outgoing,Loved “I don’t know if I will even untie you when I am do…”,,,
,8/22/24,2024-08-22 20:50:07,Incoming,I could probably fuck your in the ass and still make you squirt ,,,
,8/22/24,2024-08-22 21:19:25,Incoming,What are you doing? Did you get a toy? ,,,
,8/22/24,2024-08-22 21:26:52,Incoming,Bought that AI thing but it down work with the eyes ,,,
,8/22/24,2024-08-22 21:44:21,Incoming,Why aren’t you responding? ,,,
,8/22/24,2024-08-22 21:44:56,Incoming,You just read my question and ignore me? ,,,
,8/22/24,2024-08-22 21:53:42,Outgoing,Sorry I was sleeping. ,,,
,8/22/24,2024-08-22 21:55:25,Incoming,"Sorry, I can't talk right now.",,,
,8/22/24,2024-08-22 21:55:38,Incoming,"Hold on, call you right back ",,,
,8/22/24,2024-08-22 21:58:50,Outgoing,It’s fine. I’m sleeping I was just calling because you sounded mad.,,,
,8/23/24,2024-08-23 11:34:16,Incoming,Did you get your adderal? ,,,
,8/23/24,2024-08-23 11:36:08,Outgoing,,,,
,8/23/24,2024-08-23 11:36:08,Outgoing,Not yet. I keep checking. It says out for delivery. ,,,
,8/23/24,2024-08-23 11:36:27,Incoming,No it’s delivered ,,,
,8/23/24,2024-08-23 11:36:39,Incoming,Go down to the package room. ,,,
,8/23/24,2024-08-23 11:59:27,Outgoing,It just changed to delivered and said it was at 11:25.,,,
,8/23/24,2024-08-23 12:01:07,Incoming,Is it not there? ,,,
,8/23/24,2024-08-23 12:02:31,Outgoing,I’m checking,,,
,8/23/24,2024-08-23 12:02:39,Outgoing,O,,,
,8/23/24,2024-08-23 12:03:18,Outgoing,It is. Thank you!!!,,,
,8/23/24,2024-08-23 12:03:44,Incoming,"Welcome, I was surprised not to hear from you this morning I thought you would be down there waiting on it",,,
,8/23/24,2024-08-23 12:04:09,Outgoing,I was checking the tracking,,,
,8/23/24,2024-08-23 12:04:23,Outgoing,If I got it I would have told you.,,,
,8/23/24,2024-08-23 19:44:29,Incoming,Are you wanting to do something tonight?,,,
,8/23/24,2024-08-23 19:49:11,Outgoing,I didn’t really think about it because I thought you would be back too late.    What time are you going to be back at your place?,,,
,8/23/24,2024-08-23 19:49:21,Incoming,1030,,,
,8/23/24,2024-08-23 19:50:27,Outgoing,I guess we could get a drink somewhere. What do you want to do? ,,,
,8/23/24,2024-08-23 19:50:54,Incoming,Let’s go to edition ,,,
,8/23/24,2024-08-23 19:51:21,Outgoing,Ok :),,,
,8/23/24,2024-08-23 19:52:33,Incoming,Wear a low cut dress that shows off your tits that I can pull up bend you over and fuck you over the counter ,,,
,8/23/24,2024-08-23 19:54:23,Outgoing,Yes sir ❤️,,,
,8/23/24,2024-08-23 19:59:45,Incoming,"I want to meet you there at the bar, then when guys are hitting on you I will come up and claim my pussy ",,,
,8/23/24,2024-08-23 20:08:16,Incoming,Do you have Lexi? ,,,
,8/23/24,2024-08-23 20:19:48,Outgoing,Yes,,,
,8/23/24,2024-08-23 20:20:36,Incoming,"Okay, I think I still have some dog food at my place. We will grab her on our way home so you don’t have to take her over there before ",,,
,8/23/24,2024-08-23 20:20:57,Outgoing,Ok :),,,
,8/23/24,2024-08-23 20:22:36,Incoming,When did you get her back? ,,,
,8/23/24,2024-08-23 20:23:53,Outgoing,Today,,,
,8/23/24,2024-08-23 20:25:11,Incoming,Did Lilly bring you adderal when she dropped her off? ,,,
,8/23/24,2024-08-23 20:26:02,Outgoing,"No, why? ",,,
,8/23/24,2024-08-23 20:26:43,Incoming,I didn’t know if you asked Chris and she brought it for you ,chris,,
,8/23/24,2024-08-23 20:27:33,Incoming,"I don’t have a bunch, I am not sure what happened I thought I had an extra bottle but I couldn’t find it. ",,,
,8/23/24,2024-08-23 20:28:53,Outgoing,I get mine filled in a couple of days.,,,
,8/23/24,2024-08-23 20:30:05,Incoming,"That’s good, I should be due for mine soon. Trying to think when we went to Publix ",,,
,8/23/24,2024-08-23 20:30:31,Outgoing,It was over a month ago I’m pretty sure. ,,,
,8/23/24,2024-08-23 20:31:14,Incoming,We got it the day before I was flying out I am pretty sure. ,,,
,8/23/24,2024-08-23 20:31:58,Incoming,Looks like it’s July 28th when I filled it,,,
,8/23/24,2024-08-23 20:39:29,Outgoing,Which means you can get it filled on the 25th.,,,
,8/23/24,2024-08-23 20:42:04,Incoming,Yep. ,,,
,8/23/24,2024-08-23 20:42:44,Incoming,Damn I can’t wait to walk up and see your sexy ass at the bar and just fucking own you. That sexy ass dress with those tits popping out ,,,
,8/23/24,2024-08-23 20:45:48,Outgoing,:),,,
,8/23/24,2024-08-23 21:38:51,Incoming,Plane is ahead of schedule we’re about to land ,,,
,8/23/24,2024-08-23 21:43:59,Outgoing,Ok,,,
,8/23/24,2024-08-23 22:20:10,Outgoing,Let me know when I should walk over there,,,
,8/23/24,2024-08-23 22:20:19,Incoming,Okay will do ,,,
,8/23/24,2024-08-23 22:31:52,Incoming,You can head that way ,,,
,8/23/24,2024-08-23 22:34:51,Outgoing,Ok,,,
,8/23/24,2024-08-23 22:47:45,Outgoing,There aren’t any seats at the bar,,,
,8/23/24,2024-08-23 22:48:04,Incoming,"Hmm, that’s odd. ",,,
,8/23/24,2024-08-23 22:48:18,Incoming,I will find you. Just get a drink ,,,
,8/23/24,2024-08-23 22:49:35,Outgoing,How far are you? ,,,
,8/23/24,2024-08-23 22:49:55,Incoming,Close ,,,
,8/23/24,2024-08-23 22:51:50,Outgoing,I’m sitting outside.,,,
,8/23/24,2024-08-23 22:51:54,Incoming,Okay ,,,
,8/24/24,2024-08-24 01:46:05,Outgoing,,,,
,8/24/24,2024-08-24 01:46:05,Outgoing,You talk about standards… I’m reaching for this in my life. If you can’t live up to them I would rather have you completely out of it. Tonight is 1000% on you for no reason. I hope it’s worth it.,,,
,8/24/24,2024-08-24 01:51:45,Outgoing,"I want my Dad to be able to walk me down the aisle and I have no time for a man who consistently breaks promises and then throws a tantrum when things don’t go according to his “rules”. 

Take a step back and remember that I’ve always been 💯 truthful with you since day one even when things were hard to say.

The truth is you’ve broken my trust over and over again and act completely dumbfounded by the fact I just don’t hand it over to you again with no questions asked.

You’ve had the password to my phone for the last 6 months as a test to see if you could keep your word. 

You failed time and time again. Starting with Portugal. 

I’ve looked through your phone twice and we know the result of both those instances.",,,
,8/24/24,2024-08-24 01:54:12,Outgoing,,,,
,8/24/24,2024-08-24 01:54:12,Outgoing,Happy 1 year anniversary,,,
,8/24/24,2024-08-24 01:54:48,Outgoing,,,,
,8/24/24,2024-08-24 01:57:46,Outgoing,,,,
,8/24/24,2024-08-24 11:47:51,Incoming,https://www.instagram.com/reel/C8xCKH5SQjl/?igsh=MXJxYjg2cDhldXBkaw==,,,
,8/24/24,2024-08-24 12:21:29,Outgoing,"You don’t get it. 

You always had my respect to begin with.

And each lie and broken promise is where you begin to lose it piece by piece. ",,,
,8/24/24,2024-08-24 12:24:49,Outgoing,I went into this relationship wanting to do things right. To always be honest even when things were hard to say and I feel like that’s backfired immensely. ,,,
,8/24/24,2024-08-24 12:25:34,Incoming,Yes I have made mistakes and you did come into it with that. ,,,
,8/24/24,2024-08-24 12:32:52,Incoming,"Megan, you win. I will not ask you to do anything, if you want to delete your messages with Chris, if you want to work with him, design his website. Go out with whoever whenever. We can follow whatever rules you want. ",chris,,
,8/24/24,2024-08-24 12:33:29,Incoming,If I have to give up what I want in order to be with you then I will. ,,,
,8/24/24,2024-08-24 12:42:00,Outgoing,"I don’t want to win and I don’t want any stupid rules.

It’s not a competition. Being friends with Chris doesn’t in any way lessen my commitment and love to you.",,,
,8/24/24,2024-08-24 12:47:05,Incoming,"Okay, no rules ",,,
,8/24/24,2024-08-24 12:47:12,Incoming,No standards. ,,,
,8/24/24,2024-08-24 12:47:16,Incoming,Just enjoy life ,,,
,8/24/24,2024-08-24 12:49:34,Outgoing,Don’t cheat,,,
,8/24/24,2024-08-24 12:49:45,Outgoing,Never go to bed mad,,,
,8/24/24,2024-08-24 12:49:55,Incoming,Are those rules? ,,,
,8/24/24,2024-08-24 12:51:16,Outgoing,Yes ,,,
,8/24/24,2024-08-24 12:51:46,Incoming,Okay. No sex with anyone else otherwise nothing to ever get mad about ,,,
,8/24/24,2024-08-24 12:56:08,Outgoing,Look for ways to let you know how much you mean to me and ways to make you smile. ,,,
,8/24/24,2024-08-24 12:59:56,Incoming,That’s nice of you to say. We can do whatever you want. I don’t need to meet Chris or you stop working for him. You can keep deleting your guys texts if you want. I will follow the rule no sex with anyone else.  Is it okay if I add a request for that rule? ,,,
,8/24/24,2024-08-24 13:02:22,Outgoing,Yes.,,,
,8/24/24,2024-08-24 13:04:05,Outgoing,I don’t want to delete his text messages. I want to not feel afraid that you’re going to look through my phone and even after finding nothing make it into something. ,,,
,8/24/24,2024-08-24 13:06:15,Incoming,If we do end up having sex with someone else we just tell one another about it. ,,,
,8/24/24,2024-08-24 13:06:54,Outgoing,End of conversation. ,,,
,8/24/24,2024-08-24 13:07:16,Outgoing,Don’t talk to me. ,,,
,8/24/24,2024-08-24 13:11:07,Incoming,I don’t understand? ,,,
,8/24/24,2024-08-24 13:11:19,Incoming,But we don’t have to add that to the rule it was just a suggestion ,,,
,8/24/24,2024-08-24 13:11:30,Outgoing,Why would you even fucking say that?,,,
,8/24/24,2024-08-24 13:11:54,Outgoing,As if it were a possibility,,,
,8/24/24,2024-08-24 13:12:19,Outgoing,And fyi cheating is a lot more than putting your fucking dick in someone. ,,,
,8/24/24,2024-08-24 13:12:24,Incoming,"So that way it takes away any fear, we know we will be upfront with one another and don’t have to wonder if something happened and they didn’t tell us. ",,,
,8/24/24,2024-08-24 13:14:18,Outgoing,I’d rather be in a relationship where that isn’t a question. Why you are even thinking about doing that is besides me. ,,,
,8/24/24,2024-08-24 13:15:02,Incoming,Megan you made the rule about no sex with anyone else. ,,,
,8/24/24,2024-08-24 13:15:23,Outgoing,Really? Is that what I said? ,,,
,8/24/24,2024-08-24 13:15:48,Incoming,You said don’t cheat. ,,,
,8/24/24,2024-08-24 13:16:00,Outgoing,Very fucking different. ,,,
,8/24/24,2024-08-24 13:16:10,Outgoing,You came back with that bullshit. ,,,
,8/24/24,2024-08-24 13:16:53,Outgoing,Kissing = cheating,,,
,8/24/24,2024-08-24 13:17:01,Outgoing,Only fans = cheating ,,,
,8/24/24,2024-08-24 13:17:22,Outgoing,No shit putting your dick in someone = cheating ,,,
,8/24/24,2024-08-24 13:17:24,Incoming,"Okay, please list out what all is cheating so I know ",,,
,8/24/24,2024-08-24 13:17:34,Outgoing,Don’t be an idiot ,,,
,8/24/24,2024-08-24 13:18:20,Outgoing,How about just have self integrity. ,,,
,8/24/24,2024-08-24 13:19:50,Incoming,"Megan I just want to be accurate, you said you didn’t want my dumb rules. So you said no cheating and don’t go to bed mad are the only two rules ",,,
,8/24/24,2024-08-24 13:20:47,Outgoing,Why don’t you tell me what you think constitutes as cheating then.,,,
,8/24/24,2024-08-24 13:22:50,Incoming,Having sex with someone else ,,,
,8/24/24,2024-08-24 13:23:47,Outgoing,Go fuck yourself ,,,
,8/24/24,2024-08-24 13:24:18,Incoming,"I didn’t want to make you angry, I’m sorry I said anything. ",,,
,8/24/24,2024-08-24 13:25:07,Outgoing,You’re full of fucking shit. You know damn well you consider a lot more than that cheating. ,,,
,8/24/24,2024-08-24 13:25:47,Outgoing,So if I sucked another guys dick that’s not cheating? ,,,
,8/24/24,2024-08-24 13:26:26,Outgoing,If I was making out with someone on the couch that’s not cheating? ,,,
,8/24/24,2024-08-24 13:26:26,Incoming,That would be part of sex in my opinion but yes that would be cheating ,,,
,8/24/24,2024-08-24 13:27:08,Incoming,If you made out with someone on your couch that wouldn’t be something I like. ,,,
,8/24/24,2024-08-24 13:27:46,Outgoing,If I was having a guy send me videos of his dick and him jerking off thats not cheating? ,,,
,8/24/24,2024-08-24 13:27:50,Incoming,"Megan there are a ton of things I wouldn’t like, but I am the problem. That’s why I said we can just do the rules you want and make it simple so we don’t get mad ",,,
,8/24/24,2024-08-24 13:28:13,Outgoing,"No, you’re playing stupid. ",,,
,8/24/24,2024-08-24 13:28:46,Incoming,No i am not playing stupid. I am just trying to not set any rules and let you make them so we have the relationship the way you want ,,,
,8/24/24,2024-08-24 13:52:57,Outgoing,Have you used only fans since we last talked about it?,,,
,8/24/24,2024-08-24 13:53:52,Incoming,Yes ,,,
,8/24/24,2024-08-24 13:54:10,Outgoing,Fucking hypocrite ,,,
,8/24/24,2024-08-24 13:54:43,Outgoing,Go enjoy paying girls to send you god only knows what. ,,,
,8/24/24,2024-08-24 13:54:50,Outgoing,Another promise broken,,,
,8/24/24,2024-08-24 13:59:04,Incoming,I used it once megan when we were fighting and then deleted it. ,,,
,8/24/24,2024-08-24 13:59:15,Outgoing,I knew as soon as you diverted the conversation that you had. ,,,
,8/24/24,2024-08-24 13:59:28,Incoming,Diverted what conversation? ,,,
,8/24/24,2024-08-24 13:59:56,Outgoing,"Do you ever look in the mirror and think, “wow, I have a lot of nerve.”",,,
,8/24/24,2024-08-24 14:00:06,Incoming,Yes ,,,
,8/24/24,2024-08-24 15:18:41,Outgoing,I’m taking the dogs by the grassy near the river if you want to go,,,
,8/24/24,2024-08-24 15:50:06,Incoming,"Okay, when are you going? ",,,
,8/24/24,2024-08-24 15:52:49,Outgoing,I just got back. I was at Sparkman before that and Lexi started to get really hot. I had to carry her back. ,,,
,8/24/24,2024-08-24 15:53:18,Incoming,Okay ,,,
,8/24/24,2024-08-24 16:07:59,Outgoing,Want to go to Comic-Con? lol,,,
,8/24/24,2024-08-24 16:09:24,Incoming,I saw them walking today when I was outside this morning. Looks super cool,,,
,8/24/24,2024-08-24 16:11:15,Outgoing,Did you ever watch smallville?,,,
,8/24/24,2024-08-24 16:11:29,Incoming,I don’t think so. Not that I remember ,,,
,8/24/24,2024-08-24 16:13:25,Outgoing,,,,
,8/24/24,2024-08-24 16:13:25,Outgoing,I remember watching it but it was a long time ago. ,,,
,8/24/24,2024-08-24 16:14:13,Incoming,Is that a comic com thing? ,,,
,8/24/24,2024-08-24 16:16:53,Outgoing,,,,
,8/24/24,2024-08-24 16:16:53,Outgoing,They have this event tonight and I was trying to figure out what exactly it is.,,,
,8/24/24,2024-08-24 16:19:13,Incoming,"Interesting, yea just a commedy show for people attending the event it looks like. ",,,
,8/24/24,2024-08-24 16:19:26,Incoming,Is comicon still going on? I would think it’s almost over for the day ,,,
,8/24/24,2024-08-24 16:25:59,Outgoing,It’s over at 7,,,
,8/24/24,2024-08-24 16:27:01,Incoming,Want to go? ,,,
,8/24/24,2024-08-24 16:31:31,Outgoing,Do you think 2 hours is enough time?,,,
,8/24/24,2024-08-24 16:32:12,Outgoing,"It would actually be less than that because you have to register your wristband.

It’s going on tomorrow too.",,,
,8/24/24,2024-08-24 16:32:53,Incoming,"I have no idea, I know the Indy one is absolutely massive. It doesn’t seem like this one is to big. ",,,
,8/24/24,2024-08-24 16:33:00,Incoming,Especially for how cheap tickets are ,,,
,8/24/24,2024-08-24 16:33:50,Incoming,Tickets 100 bucks for both of us,,,
,8/24/24,2024-08-24 16:36:47,Outgoing,I joined the waitlist for this,,,
,8/24/24,2024-08-24 16:36:49,Outgoing,https://www.keelfarms.com/events-calendar,,,
,8/24/24,2024-08-24 16:37:22,Incoming,What is it? ,,,
,8/24/24,2024-08-24 16:37:35,Outgoing,We can go to Comic-Con if you want to,,,
,8/24/24,2024-08-24 16:38:09,Outgoing,,,,
,8/24/24,2024-08-24 16:38:48,Incoming,"That wine thing looks awesome, are there no more tickets? ",,,
,8/24/24,2024-08-24 16:38:55,Incoming,I would rather do that then comicon ,,,
,8/24/24,2024-08-24 16:40:13,Outgoing,It says 13 people ahead of us for the walk in waitlist.,,,
,8/24/24,2024-08-24 16:42:37,Incoming,Wonder what that means in terms of getting in. ,,,
,8/24/24,2024-08-24 16:47:09,Outgoing,I don’t know. It’s 30 mins away in plant city.,,,
,8/24/24,2024-08-24 16:47:49,Incoming,Try calling them and ask them what the deal is on the walk ins ,,,
,8/24/24,2024-08-24 17:15:21,Outgoing,They said we can buy tickets at the door.,,,
,8/24/24,2024-08-24 17:15:36,Incoming,Perfect. So the waitlist doesn’t really mean anything ,,,
,8/24/24,2024-08-24 17:19:54,Outgoing,"No. Let’s go soon. I want to walk around before it starts and they have live music 4-8.

They also had plantae palooza today from 11-3 :(",,,
,8/24/24,2024-08-24 17:21:02,Incoming,Okay when can you be ready ,,,
,8/24/24,2024-08-24 17:22:50,Outgoing,10 mins,,,
,8/24/24,2024-08-24 17:39:18,Incoming,"Shit babe, it will take me longer then that lol",,,
,8/24/24,2024-08-24 17:45:22,Outgoing,How long?,,,
,8/24/24,2024-08-24 17:51:30,Incoming,610,,,
,8/24/24,2024-08-24 17:58:05,Outgoing,How is it taking you that long,,,
,8/24/24,2024-08-24 17:58:22,Outgoing,You asked when I could be ready at 5:20.,,,
,8/24/24,2024-08-24 18:03:02,Incoming,What’s the address to the place ,,,
,8/24/24,2024-08-24 18:10:26,Incoming,I was getting my hair cut when you asked that’s what took me so long ,,,
,8/24/24,2024-08-24 18:11:03,Incoming,I will order the Uber if you tell me the address. ,,,
,8/24/24,2024-08-24 18:11:17,Outgoing,,,,
,8/24/24,2024-08-24 18:13:10,Incoming,"Thank you, I am ordering it now. ",,,
,8/24/24,2024-08-24 18:19:11,Incoming,Head down,,,
,8/24/24,2024-08-24 18:19:24,Incoming,"Driver is pulling up, getting you then me. ",,,
,8/24/24,2024-08-24 18:19:37,Outgoing,Ok,,,
,8/24/24,2024-08-24 18:20:18,Incoming,,,,
,8/24/24,2024-08-24 18:26:29,Outgoing,Grabbing Lacroix if you haven’t left yet,,,
,8/24/24,2024-08-24 19:27:07,Outgoing,Where did you go?,,,
,8/24/24,2024-08-24 19:29:44,Incoming,Inside ,,,
,8/24/24,2024-08-24 19:29:44,Incoming,Inside ,,,
,8/24/24,2024-08-24 19:30:15,Outgoing,I got us seats at the bar. ,,,
,8/24/24,2024-08-24 19:31:05,Outgoing,Were you just not going to tell me you were in there? ,,,
,8/24/24,2024-08-24 19:31:27,Incoming,Okay outside ,,,
,8/24/24,2024-08-24 20:47:20,Incoming,Ride is here ,,,
,8/24/24,2024-08-24 23:16:50,Outgoing,I can’t believe you didn’t walk over to help,,,
,8/24/24,2024-08-24 23:17:36,Incoming,I am taking my dog out. I can help you with Chris and your dog after I take care of mine ,Chris,,
,8/24/24,2024-08-24 23:24:12,Outgoing,Don’t bother,Chris,,
,8/24/24,2024-08-24 23:26:49,Outgoing,1. If that were the case you could have taken Charles out by walking over,Chris,,
,8/24/24,2024-08-24 23:27:15,Outgoing,2. What was the point of throwing Chris into that statement?,Chris,,
,8/24/24,2024-08-24 23:27:42,Outgoing,You think if it was just Lexi there I wouldn’t have reacted the same way? ,Chris,,
,8/24/24,2024-08-24 23:27:43,Incoming,"No point, but that’s what the issue is correct? You have to take Chris dog and yours which is a lot ",Chris,,
,8/24/24,2024-08-24 23:28:20,Outgoing,No,,,
,8/24/24,2024-08-24 23:28:30,Incoming,Okay I thought two dogs was a lot ,,,
,8/24/24,2024-08-24 23:28:47,Outgoing,Im talking about carrying all of my stuff because I had to remove it all from your place. ,,,
,8/24/24,2024-08-24 23:29:23,Incoming,"I didn’t realize you had stuff, I don’t know what you would be bringing. I figured you would just change cloths and walk ",,,
,8/24/24,2024-08-24 23:29:33,Outgoing,Whatever ,,,
,8/24/24,2024-08-24 23:29:54,Incoming,It’s not really fair for me to know that is it? ,,,
,8/24/24,2024-08-24 23:50:26,Outgoing,I don’t understand what you’re trying to accomplish by playing stupid. ,,,
,8/24/24,2024-08-24 23:50:46,Incoming,I’m not playing stupid please stop calling me stupid ,,,
,8/24/24,2024-08-24 23:50:48,Outgoing,When since you’ve known me have I ever left Lexi home by herself? ,,,
,8/24/24,2024-08-24 23:51:18,Outgoing,Get a fucking grip. I didn’t call you stupid. Learn the fucking difference.,,,
,8/24/24,2024-08-24 23:51:51,Incoming,Please stop cussing at me ,,,
,8/24/24,2024-08-24 23:52:02,Outgoing,"You thought I just wanted to go over there, fuck you and walk home by myself? ",,,
,8/24/24,2024-08-24 23:52:10,Outgoing,No thank you. ,,,
,8/25/24,2024-08-25 00:45:52,Incoming,,,,
,8/25/24,2024-08-25 00:47:33,Outgoing,Fuck you,,,
,8/25/24,2024-08-25 00:47:51,Incoming,I know ,,,
,8/25/24,2024-08-25 00:48:17,Outgoing,You purposely made me walk over there to pull that fucking shit,,,
,8/25/24,2024-08-25 00:48:47,Incoming,,,,
,8/25/24,2024-08-25 00:48:51,Outgoing,My phone is about to die ,,,
,8/25/24,2024-08-25 00:49:36,Outgoing,And there are ghetto peoplr out here ,,,
,8/25/24,2024-08-25 00:49:52,Incoming,Walk towards me I’m walking to you ,,,
,8/25/24,2024-08-25 00:52:22,Incoming,Where are you ,,,
,8/25/24,2024-08-25 19:36:58,Incoming,Where did you go? ,,,
,8/25/24,2024-08-25 19:38:49,Incoming,Let’s get some pictures ,,,
,8/26/24,2024-08-26 12:09:37,Incoming,,,,
,8/26/24,2024-08-26 12:09:39,Incoming,Normal range ,,,
,8/26/24,2024-08-26 12:13:11,Outgoing,That’s so good!,,,
,8/26/24,2024-08-26 12:22:31,Outgoing,My Dad called and said we have to get married before he’s in a wheelchair.,,,
,8/26/24,2024-08-26 12:23:29,Incoming,With medical advancements happening so rapidly that is a long time till that ,,,
,8/26/24,2024-08-26 12:28:06,Outgoing,lol,,,
,8/26/24,2024-08-26 17:04:10,Incoming,He said he could do your first appointment virtual. ,,,
,8/26/24,2024-08-26 17:05:51,Outgoing,"Thank you. I am waiting to hear back from Done to have them try sending it to Walgreens. 

I made an appointment with Melissa’s doctor but his first opening isn’t until January. ",,,
,8/26/24,2024-08-26 17:06:19,Incoming,"Jesus, January is nuts ",,,
,8/26/24,2024-08-26 17:06:45,Outgoing,Remember all the craziness with the obgyn,,,
,8/26/24,2024-08-26 17:09:24,Incoming,"Yea, you may as well just scheudle those every year to be safe ",,,
,8/26/24,2024-08-26 17:39:03,Outgoing,I do go annually. The crazy wait time is just for new patients. ,,,
,8/26/24,2024-08-26 17:39:46,Incoming,Doesn’t make any sense ,,,
,8/26/24,2024-08-26 18:56:08,Incoming,Did you get it moved to Walgreens? ,,,
,8/26/24,2024-08-26 19:24:56,Outgoing,They haven’t responded yet. They probably won’t until tomorrow.,,,
,8/26/24,2024-08-26 19:37:30,Incoming,Do you need to come get more adderall? ,,,
,8/26/24,2024-08-26 20:25:13,Outgoing,Yes,,,
,8/26/24,2024-08-26 20:34:20,Outgoing,Are you back from whatever errands you were running?,,,
,8/26/24,2024-08-26 20:34:41,Incoming,Who said I was running errands? ,,,
,8/26/24,2024-08-26 20:35:20,Outgoing,Something like picking up a license and something else.  ,,,
,8/26/24,2024-08-26 20:35:35,Outgoing,I was in the middle of a meltdown so I don’t k ow exactly. ,,,
,8/26/24,2024-08-26 20:35:45,Incoming,Yea I haven’t left so not sure ,,,
,8/26/24,2024-08-26 20:36:29,Outgoing,"When I asked you if you had your script called in you listed things you had to do. One of them was going to pick up a license, right?",,,
,8/26/24,2024-08-26 20:36:53,Incoming,"At some point I have to yes, I didn’t get to it today.",,,
,8/26/24,2024-08-26 20:37:23,Outgoing,I thought you were saying you had to do that before you could go get your script. ,,,
,8/26/24,2024-08-26 20:38:15,Incoming,"Yes I will, or I can try to use my passport ",,,
,8/26/24,2024-08-26 20:39:58,Outgoing,I’m walking over. I don’t have a key so what would you like me to do?,,,
,8/26/24,2024-08-26 20:40:36,Incoming,Reception will call me and let you up ,,,
,8/26/24,2024-08-26 20:48:05,Incoming,If you don’t want to walk up I can come down and meet you at the door ,,,
,8/26/24,2024-08-26 20:48:36,Outgoing,I’m letting the dogs go to the bathroom outside your place,,,
,8/26/24,2024-08-26 20:48:54,Outgoing,I don’t mind coming up,,,
,8/26/24,2024-08-26 20:49:08,Incoming,"Okay, see you shortly ",,,
,8/26/24,2024-08-26 20:51:58,Outgoing,No one is at the desk right now,,,
,8/26/24,2024-08-26 20:52:12,Incoming,Okay I will come get you ,,,
,8/26/24,2024-08-26 21:04:07,Outgoing,,,,
,8/26/24,2024-08-26 22:07:47,Outgoing,MJNY Mens Casual Comfortable Genuine Leather Lightweight Driving Moccasins Classic Fashion Buckle Loafer Slip On Breathable Driving Loafer,,,
,8/26/24,2024-08-26 22:07:51,Outgoing,https://a.co/d/bSV1AkM,,,
,8/26/24,2024-08-26 22:08:04,Incoming,Thank you ,,,
,8/26/24,2024-08-26 22:23:31,Incoming,https://www.facebook.com/share/r/gDsmsdm5FBr77adj/?mibextid=0r8j9z,,,
,8/26/24,2024-08-26 22:28:29,Outgoing,I can do that :) ,,,
,8/26/24,2024-08-26 22:38:34,Incoming,You ever seen that guys show? ,,,
,8/26/24,2024-08-26 22:39:24,Outgoing,"No, I’ve never heard of it. ",,,
,8/26/24,2024-08-26 22:39:50,Incoming,https://www.facebook.com/share/r/Z5x1omcepTLn2msx/?mibextid=0r8j9z,,,
,8/26/24,2024-08-26 22:40:01,Incoming,He has some good interviews ,,,
,8/26/24,2024-08-26 22:42:20,Incoming,https://www.facebook.com/share/r/Vo27XF98My5ur3g6/?mibextid=0r8j9z,,,
,8/26/24,2024-08-26 22:42:44,Incoming,Basically just revealing how feminism isn’t helping ,,,
,8/26/24,2024-08-26 22:43:02,Outgoing,I hate feminism. ,,,
,8/26/24,2024-08-26 22:43:54,Outgoing,But I don’t agree with what he saying in that reel. I don’t think anyone thinks it’s bad if a guy wants a girl that is younger and not overweight.,,,
,8/26/24,2024-08-26 22:45:32,Incoming,https://www.facebook.com/share/r/c9CB68JJks2ajsU7/?mibextid=0r8j9z,,,
,8/26/24,2024-08-26 22:46:29,Incoming,"Or submissive? I think the point was that women can have preferences and it is widely accepted, but if a man has things he wants in a women it is often seen as controlling ",,,
,8/26/24,2024-08-26 22:47:24,Outgoing,I don’t agree with that. ,,,
,8/26/24,2024-08-26 22:48:46,Outgoing,The word submissive has a bad connotation but what it really means is completely fine. ,,,
,8/26/24,2024-08-26 22:54:25,Outgoing,"You’ve read the book the untethered soul, right? 

I just signed up for a plat book club posted in the SoFl WhatsApp group.",,,
,8/26/24,2024-08-26 22:54:26,Outgoing,https://bit.ly/Love_BookClub_Call,,,
,8/26/24,2024-08-26 22:55:53,Incoming,Yes I have read it ,,,
,8/26/24,2024-08-26 22:56:21,Incoming,I don’t know what SoFi group is ,,,
,8/26/24,2024-08-26 22:56:58,Incoming,Did you just send me a FB friend request? ,,,
,8/26/24,2024-08-26 23:00:27,Outgoing,When you sent me that link it said we weren’t friends on Facebook.,,,
,8/26/24,2024-08-26 23:00:39,Outgoing,South Florida,,,
,8/26/24,2024-08-26 23:02:17,Incoming,"O okay, duh lol ",,,
,8/26/24,2024-08-26 23:02:32,Outgoing,"Laughed at “O okay, duh lol ”",,,
,8/26/24,2024-08-26 23:03:01,Incoming,https://www.facebook.com/share/r/aBk58tFGEc6hwTAZ/?mibextid=0r8j9z,,,
,8/26/24,2024-08-26 23:03:04,Incoming,This guy is funny ,,,
,8/26/24,2024-08-26 23:11:44,Outgoing,Did you ever actually read my relationship life book?,,,
,8/26/24,2024-08-26 23:11:46,Outgoing,https://docs.google.com/document/d/1RjU5HOPDO4tEZ3rqu6I8SyB2bEGBSXXWTfqacnUHqCo/edit?usp=drive_link,,,
,8/26/24,2024-08-26 23:11:46,Incoming,What made you bring up the book club? ,,,
,8/26/24,2024-08-26 23:12:10,Outgoing,Because I thought you had said that was a book you really liked. ,,,
,8/26/24,2024-08-26 23:17:16,Incoming,Yes it’s a good book.  I did read it you send it to me back when you were still in Chicago ,,,
,8/26/24,2024-08-26 23:24:02,Outgoing,I feel like you think are visions and values are misaligned but I feel like they are very congruent.,,,
,8/26/24,2024-08-26 23:27:14,Incoming,I think our visions are close. ,,,
,8/26/24,2024-08-26 23:27:36,Outgoing,Ok,,,
,8/26/24,2024-08-26 23:39:44,Incoming,lol omg this is hilarious ,,,
,8/26/24,2024-08-26 23:39:48,Incoming,https://www.facebook.com/share/r/cv5DKU2DinJbPhDe/?mibextid=0r8j9z,,,
,8/26/24,2024-08-26 23:45:01,Outgoing,Lol,,,
,8/26/24,2024-08-26 23:47:04,Incoming,"Jesus, this girl. “If a man is masculine enough” lol",,,
,8/26/24,2024-08-26 23:47:06,Incoming,https://www.facebook.com/share/r/eeSnQc5nDK59FSsk/?mibextid=0r8j9z,,,
,8/26/24,2024-08-26 23:51:48,Incoming,"This Rachel Wilson girl is really cool, I haven’t heard of her before.",Trade of masculine energy bs,,
,8/26/24,2024-08-26 23:51:49,Incoming,https://www.facebook.com/share/r/bEFBEFGjbmQkw9Qy/?mibextid=0r8j9z,,,
,8/26/24,2024-08-26 23:59:17,Outgoing,Babe you’ve been watching these reels for 2 hours.,,,
,8/27/24,2024-08-27 00:00:24,Incoming,https://www.facebook.com/share/r/KAT6VZbjsY2ChuHJ/?mibextid=0r8j9z,,,
,8/27/24,2024-08-27 00:00:34,Incoming,This girl is very elegant ,,,
,8/27/24,2024-08-27 00:00:43,Incoming,Shit yes I have ,,,
,8/27/24,2024-08-27 00:02:08,Outgoing,Yes she has a beautiful voice. ,,,
,8/27/24,2024-08-27 00:04:01,Incoming,I will stop sending them to you ,,,
,8/27/24,2024-08-27 00:06:43,Outgoing,You’re going to keep watching them?,,,
,8/27/24,2024-08-27 00:39:39,Outgoing,"If you’re going to watch relationship things I think it would be better to watch from people who are qualified

John Gottman
https://www.instagram.com/gottmaninstitute?igsh=dzFxMGZ4ODYwaHB0

Esther Perez
https://www.instagram.com/estherperelofficial?igsh=MnQ2M2RqdGZpMG1z

Stan Tatkin
https://www.instagram.com/drstantatkin?igsh=MTV2dHU3eHA1dWZjNQ==

Gary Chapman
https://www.instagram.com/5lovelanguages?igsh=MXNoeXh4czZ1emJlNQ==

Tony Robbins",,,
,8/27/24,2024-08-27 00:40:30,Incoming,You think all those people I sent you are unqualified? ,,,
,8/27/24,2024-08-27 00:40:45,Incoming,Or that what they are saying isn’t true? ,,,
,8/27/24,2024-08-27 00:40:50,Outgoing,I haven’t done any research.,,,
,8/27/24,2024-08-27 00:41:15,Incoming,"I don’t think any of it was advise, it was more real world interviews ",,,
,8/27/24,2024-08-27 00:42:38,Outgoing,"The accounts I sent you are some of the top experts on happy and lasting marriages. 

There is this black pastor that I follow that focuses on relationships that I really like, but I can’t remember his name. I’ll try to find it. ",,,
,8/27/24,2024-08-27 00:43:50,Incoming,None of those links are working ,,,
,8/27/24,2024-08-27 00:44:06,Incoming,I click on them and it’s just opening up Instagram not taking me to there thing ,,,
,8/27/24,2024-08-27 00:45:06,Incoming,If you haven’t done any research why are you discounting it telling me to watch these other accounts? ,,,
,8/27/24,2024-08-27 00:47:22,Outgoing,"That’s weird. 

https://www.instagram.com/gottmaninstitute?igsh=dzFxMGZ4ODYwaHB0 (https://www.instagram.com/gottmaninstitute?igsh=dzFxMGZ4ODYwaHB0)",,,
,8/27/24,2024-08-27 00:47:37,Outgoing,Oh I think I see why,,,
,8/27/24,2024-08-27 00:47:49,Incoming,"I was able to find the Stan guys stuff. Very progressive for sure, therapist that specializes in relationships it looks like ",,,
,8/27/24,2024-08-27 00:47:58,Outgoing,https://www.instagram.com/gottmaninstitute?igsh=dzFxMGZ4ODYwaHB0,,,
,8/27/24,2024-08-27 00:48:27,Outgoing,They are all therapists that specialize in relationships and marriages ,,,
,8/27/24,2024-08-27 00:48:39,Outgoing,Gary Chapman wrote the 5 love languages,,,
,8/27/24,2024-08-27 00:48:58,Outgoing,https://www.instagram.com/estherperelofficial?igsh=MnQ2M2RqdGZpMG1z,,,
,8/27/24,2024-08-27 00:51:01,Outgoing,Allison Armstrong wrote the queen’s code,,,
,8/27/24,2024-08-27 00:51:03,Outgoing,https://www.instagram.com/reel/C-Imh0dSerI/?igsh=MWFudjZ3eXVjbzN3ag==,,,
,8/27/24,2024-08-27 00:52:04,Outgoing,https://www.instagram.com/reel/C-8eL2KNfQn/?igsh=MTZuem1pbTBhODZvaw==,,,
,8/27/24,2024-08-27 00:52:15,Outgoing,,,,
,8/27/24,2024-08-27 00:54:05,Incoming,I can see you are sending me the same thing by different people about threatening the relationship. ,,,
,8/27/24,2024-08-27 00:54:38,Outgoing,The last two were. The first one was about women criticizing,,,
,8/27/24,2024-08-27 00:55:53,Incoming,"Yea, very educated that is for sure. The ones I was watching were more of real life experiences. Also seems like these therapist may be catering more towards marriages. ",,,
,8/27/24,2024-08-27 00:57:36,Outgoing,I like Jay Shetty a lot too. ,,,
,8/27/24,2024-08-27 00:59:00,Incoming,"Yea, takes more of a feminine approach and really speaks well ",,,
,8/27/24,2024-08-27 01:03:56,Outgoing,Why are you still up?,,,
,8/27/24,2024-08-27 15:07:27,Outgoing,Hi babe ❤️ I hope you’re having a good day! ,,,
,8/27/24,2024-08-27 15:09:14,Incoming,"Thank you, I hope you are having a good day as well ",,,
,8/27/24,2024-08-27 22:42:06,Incoming,Damn man wish you were here so I could roll you over and fuck uou ,,,
,8/27/24,2024-08-27 22:43:22,Outgoing,Emphasized “Damn man wish you were here so I could roll you ov…”,,,
,8/27/24,2024-08-27 22:43:50,Outgoing,🔥,,,
,8/28/24,2024-08-28 08:49:09,Incoming,I think someone stole my credit card ,,,
,8/28/24,2024-08-28 08:52:33,Outgoing,Lol,,,
,8/28/24,2024-08-28 08:53:29,Outgoing,I told you I was getting that stuff. You were almost out of everything.,,,
,8/28/24,2024-08-28 08:54:10,Incoming,"Really, everything on that list is stuff I was almost out of ",,,
,8/28/24,2024-08-28 08:55:13,Outgoing,"Go look. Like 5 laundry pods, 6 dishwashing pods, no fabric softener, no soap in the bathroom.",,,
,8/28/24,2024-08-28 08:56:01,Incoming,Okay. Everything on the order is a replacement item ,,,
,8/28/24,2024-08-28 08:56:24,Outgoing,The robe is actually for your benefit.,,,
,8/28/24,2024-08-28 08:56:32,Incoming,lol,,,
,8/28/24,2024-08-28 08:57:12,Outgoing,"1. I won’t complain about it being cold
2. I can wear sexy nightgowns to bed",,,
,8/28/24,2024-08-28 08:58:02,Outgoing,Instead of sweatpants and sweatshirts,,,
,8/28/24,2024-08-28 08:59:04,Incoming,3. You go to bed on my schedule so I can get up early and make money,,,
,8/28/24,2024-08-28 09:00:02,Outgoing,I do go to bed with you.,,,
,8/28/24,2024-08-28 09:00:14,Incoming,On my schedule ,,,
,8/28/24,2024-08-28 09:00:25,Outgoing,I wasn’t with you last night and you were up super late,,,
,8/28/24,2024-08-28 09:00:44,Outgoing,Plus that has nothing to do with the robe ,,,
,8/28/24,2024-08-28 09:01:37,Outgoing,I meant the night before that. ,,,
,8/28/24,2024-08-28 09:01:40,Incoming,I wasn’t up late at all. I went to bet at 930. I just woke up randomly and rolled over thinking you were there and you weren’t that’s when I texted you,,,
,8/28/24,2024-08-28 09:02:21,Incoming,Yes but that isn’t normal and not what I want my schedule to be ,,,
,8/28/24,2024-08-28 09:03:30,Outgoing,"I know, I’m just pointing out that that was not my fault :)",,,
,8/28/24,2024-08-28 09:09:39,Outgoing,,,,
,8/28/24,2024-08-28 09:09:39,Outgoing,,,,
,8/28/24,2024-08-28 09:09:39,Outgoing,So random! ,,,
,8/28/24,2024-08-28 09:22:31,Incoming,Yes it is. ,,,
,8/28/24,2024-08-28 10:01:23,Outgoing,Babe,,,
,8/28/24,2024-08-28 10:19:57,Outgoing,Emphasized “Babe”,,,
,8/28/24,2024-08-28 10:21:56,Incoming,What? ,,,
,8/28/24,2024-08-28 10:25:10,Outgoing,What are you doing?,,,
,8/28/24,2024-08-28 10:26:36,Incoming,Just got off the phone with Exotec ,,,
,8/28/24,2024-08-28 10:28:20,Outgoing,Can I have some of your drugs?,,,
,8/28/24,2024-08-28 10:28:35,Incoming,lol ,,,
,8/28/24,2024-08-28 10:35:57,Outgoing,????,,,
,8/28/24,2024-08-28 10:38:28,Incoming,"Yes you can have some drugs. 

You just said Babe and I was thinking it was something else, so made me laugh when it was just you hitting me up wanting adderal ",,,
